{"scopus-eid": "2-s2.0-84990232272", "originalText": "serial JL 271700 291210 291692 291715 291813 291814 291817 291871 31 European Journal of Operational Research EUROPEANJOURNALOPERATIONALRESEARCH 2016-06-14 2016-06-14 2016-09-01 2016-09-01 2019-10-29T12:20:48 1-s2.0-S0377221716304349 S0377-2217(16)30434-9 S0377221716304349 10.1016/j.ejor.2016.06.014 S300 S300.1 FULL-TEXT 1-s2.0-S0377221716X00173 2019-11-01T08:48:02.675056Z 0 0 20170101 2017 2016-06-14T06:28:57.073489Z articleinfo articletitlenorm authfirstinitialnorm authfirstsurnamenorm cid cids contenttype copyright crossmark dateloaded dateloadedtxt datesearch datesort dateupdated dco docsubtype doctype doi eid ewtransactionid hubeid indexeddate issfirst issn issnnorm issuelist itemstage itemtransactionid itemweight openaccess openarchive pg pgfirst pglast pii piinorm pubdatestart pubdatetxt pubyr sectiontitle sortorder srctitle srctitlenorm srctype ssids alllist content subj subheadings tomb volfirst volissue volumelist webpdf webpdfpagecount yearnav figure table body mmlmath acknowledge affil articletitle auth authfirstini authfull authkeywords authlast highlightsabst orcid primabst pubtype ref 0377-2217 03772217 true 256 256 1 1 Volume 256, Issue 1 24 242 251 242 251 20170101 1 January 2017 2017-01-01 2017 Innovative Applications of O.R. article fla \u00a9 2016 Elsevier B.V. All rights reserved. COMPACTMIXEDINTEGERLINEARPROGRAMMINGMODELSMINIMUMWEIGHTEDTREERECONSTRUCTIONPROBLEM FORTZ B 1 Introduction 2 Formulations 2.1 Path-weight formulation 2.2 Path-edges formulation 3 Computational results 4 Conclusion Acknowledgments References ABDI 1990 43 59 H TREESHIERARCHICALSTRUCTURES ADDITIVETREEREPRESENTATIONS BHAMIDI 2010 176 203 S BUNEMAN 1974 48 50 P BYUN 2006 1189 1198 S COMPUTATIONALSCIENCEAPPLICATIONSICCSA2006 REDUCINGDELIVERYDELAYINHRMTREE CATANZARO 2009 112 125 D CATANZARO 2015 753 765 D CATANZARO 2009 126 140 D CATANZARO 2012 276 294 D CAVALLISFORZA 1967 233 257 L CHUNG 2001 432 448 F COATES 2002 11 20 M ACMSIGMETRICSPERFORMANCEEVALUATIONREVIEW MAXIMUMLIKELIHOODNETWORKTOPOLOGYIDENTIFICATIONEDGEBASEDUNICASTMEASUREMENTS COATES 2003 192 203 M PROCEEDINGS3RDACMSIGCOMMCONFERENCEINTERNETMEASUREMENTIMC03 MERGINGLOGICALTOPOLOGIESUSINGENDTOENDMEASUREMENTS CORTER 1986 429 451 J CUNNINGHAM 1980 593 605 J DAY 1987 461 467 W DIAS 2012 774 788 Z DONNET 2013 44 81 B DATATRAFFICMONITORINGANALYSISMEASUREMENTCLASSIFICATIONANOMALYDETECTIONQUALITYEXPERIENCE INTERNETTOPOLOGYDISCOVERY DONNET 2007 2 14 B DONNET 2006 2210 2220 B DRESS 1984 321 402 A DUFFIELD 2002 26 45 N DUFFIELD 2001 1636 1645 N INFOCOM2001TWENTIETHANNUALJOINTCONFERENCEIEEECOMPUTERCOMMUNICATIONSSOCIETIESPROCEEDINGSIEEEVOLUME3 ADAPTIVEMULTICASTTOPOLOGYINFERENCE EDELBERG 1976 23 39 M ERIKSSON 2010 1 9 B PROCEEDINGSINFOCOM2010IEEECONFERENCECOMPUTERCOMMUNICATIONS TOWARDPRACTICALUSENETWORKTOMOGRAPHYFORINTERNETTOPOLOGYDISCOVERY FARACH 1995 155 179 M FELSENSTEIN 2004 147 175 J INFERRINGPHYLOGENIESCHAPTER11 DISTANCEMATRIXMETHODS FIORINI 2012 31 35 S GASCHEN 2002 2354 2360 B GILMORE 1979 425 431 G GOUVEIA 1995 959 970 L GOUVEIA 1996 178 190 L GOVINDAN 2000 1371 1380 R PROCEEDING19THANNUALJOINTCONFERENCEIEEECOMPUTERCOMMUNICATIONSSOCIETIESVOLUME3 HEURISTICFORINTERNETMAPDISCOVERY HADDADI 2008 48 69 H HAKIMI 1972 255 269 S HAKIMI 1965 305 317 S HUSON 2011 23 35 D ISAEV 2006 A INTRODUCTIONMATHEMATICALMETHODSINBIOINFORMATICS JUNKER 2008 B ANALYSISBIOLOGICALNETWORKS KOOLEN 2009 1164 1171 A MAGNANTI 1995 503 615 T NETWORKMODELSHANDBOOKSINOPERATIONSRESEARCHMANAGEMENTSCIENCEVOL7 OPTIMALTREES MILLER 1960 326 329 C MOUNT 2001 D BIOINFORMATICSSEQUENCEGENOMEANALYSIS NEI 2000 M MOLECULAREVOLUTIONPHYLOGENETICS NI 2011 7798 7809 J NI 2008 J INFOCOM200827THIEEECONFERENCECOMPUTERCOMMUNICATIONS NETWORKROUTINGTOPOLOGYINFERENCEENDTOENDMEASUREMENTS PARKER 1996 1875 1905 D PAUPLIN 2000 41 47 Y SATTATH 1977 319 345 S SHIH 2007 1708 1718 M SIMOESPEREIRA 1987 277 287 J SIMOESPEREIRA 1990 299 312 J SIMOESPEREIRA 1982 1 17 J SOETE 1983 621 626 G VARONE 1998 337 346 S VARONE 2006 102 111 S FORTZX2017X242 FORTZX2017X242X251 FORTZX2017X242XB FORTZX2017X242X251XB 2018-09-01T00:00:00Z http://creativecommons.org/licenses/by-nc-nd/4.0/ \u00a9 2016 Elsevier B.V. All rights reserved. 2019-03-25T13:40:25.896Z http://vtw.elsevier.com/data/voc/AddOnTypes/50.7/nlp S0377221716304349 Belgian Science Policy Office Belgian Federal Science Policy Office http://data.elsevier.com/vocabulary/SciValFunders/501100002749 http://sws.geonames.org/2802361/ Portuguese Foundation for Science and Technology UID/MAT/04106/2013 SFRH/BD/76268/2011 FCT FCT Fuel Cell Technologies Program http://data.elsevier.com/vocabulary/SciValFunders/100006136 http://sws.geonames.org/6252001/ CIDMA Portuguese Interuniversity Attraction Poles Programme P7/36 Center for Research and Development in Mathematics and Applications The research of Cristina Requejo and Olga Oliveira has been partially supported by Portuguese funds through the Center for Research and Development in Mathematics and Applications (CIDMA) and the FCT, the Portuguese Foundation for Science and Technology, within project UID/MAT/04106/2013. The research of Olga Oliveira has been supported by a research fellowship (grant SFRH/BD/76268/2011) through FCT, the Portuguese Foundation for Science and Technology, within the project POPH-QREN. The research of Bernard Fortz and Olga Oliveira has been funded by the Interuniversity Attraction Poles Programme P7/36 COMEX initiated by the Belgian Science Policy Office. item S0377-2217(16)30434-9 S0377221716304349 1-s2.0-S0377221716304349 10.1016/j.ejor.2016.06.014 271700 2019-11-01T08:48:02.675056Z 2017-01-01 1-s2.0-S0377221716304349-main.pdf https://s3.amazonaws.com/prod-ucs-content-store-us-east/content/pii:S0377221716304349/MAIN/application/pdf/c56672fa630aa048b0d6875882ba9896/main.pdf main.pdf pdf true 741485 MAIN 10 1-s2.0-S0377221716304349-main_1.png https://s3.amazonaws.com/prod-ucs-content-store-us-east/content/pii:S0377221716304349/PREVIEW/image/png/3fe6e66b792961286b74c800ff8b6d2b/main_1.png main_1.png png 61525 849 656 IMAGE-WEB-PDF 1 1-s2.0-S0377221716304349-gr1.sml https://s3.amazonaws.com/prod-ucs-content-store-us-east/content/pii:S0377221716304349/gr1/THUMBNAIL/image/gif/b8170f2f74f77d696f5dd1cf47205a3a/gr1.sml gr1 gr1.sml sml 5431 86 219 IMAGE-THUMBNAIL 1-s2.0-S0377221716304349-gr2.sml https://s3.amazonaws.com/prod-ucs-content-store-us-east/content/pii:S0377221716304349/gr2/THUMBNAIL/image/gif/1c9b610edb1abbbaa01e6eac5842e3df/gr2.sml gr2 gr2.sml sml 7033 100 219 IMAGE-THUMBNAIL 1-s2.0-S0377221716304349-gr3.sml https://s3.amazonaws.com/prod-ucs-content-store-us-east/content/pii:S0377221716304349/gr3/THUMBNAIL/image/gif/98a640266d621facafb1278a23af75ed/gr3.sml gr3 gr3.sml sml 5275 44 219 IMAGE-THUMBNAIL 1-s2.0-S0377221716304349-gr4.sml https://s3.amazonaws.com/prod-ucs-content-store-us-east/content/pii:S0377221716304349/gr4/THUMBNAIL/image/gif/835ea05463d2928169bf836ef6eb1735/gr4.sml gr4 gr4.sml sml 4952 38 219 IMAGE-THUMBNAIL 1-s2.0-S0377221716304349-gr5.sml https://s3.amazonaws.com/prod-ucs-content-store-us-east/content/pii:S0377221716304349/gr5/THUMBNAIL/image/gif/e52309a23ebdfa40d66fcd1ea7507a64/gr5.sml gr5 gr5.sml sml 9380 126 219 IMAGE-THUMBNAIL 1-s2.0-S0377221716304349-gr1.jpg https://s3.amazonaws.com/prod-ucs-content-store-us-east/content/pii:S0377221716304349/gr1/DOWNSAMPLED/image/jpeg/43ebd5b49d59e17509b7d95a56187b3e/gr1.jpg gr1 gr1.jpg jpg 15354 180 461 IMAGE-DOWNSAMPLED 1-s2.0-S0377221716304349-gr2.jpg https://s3.amazonaws.com/prod-ucs-content-store-us-east/content/pii:S0377221716304349/gr2/DOWNSAMPLED/image/jpeg/94cd5c4a900529ebf306dfeab6c65be7/gr2.jpg gr2 gr2.jpg jpg 7106 73 160 IMAGE-DOWNSAMPLED 1-s2.0-S0377221716304349-gr3.jpg https://s3.amazonaws.com/prod-ucs-content-store-us-east/content/pii:S0377221716304349/gr3/DOWNSAMPLED/image/jpeg/1e95de5d4a2dd34b92d71717bcbc3743/gr3.jpg gr3 gr3.jpg jpg 11713 69 342 IMAGE-DOWNSAMPLED 1-s2.0-S0377221716304349-gr4.jpg https://s3.amazonaws.com/prod-ucs-content-store-us-east/content/pii:S0377221716304349/gr4/DOWNSAMPLED/image/jpeg/d0efbfaec538ce88e8e572db4e5114d1/gr4.jpg gr4 gr4.jpg jpg 21587 113 658 IMAGE-DOWNSAMPLED 1-s2.0-S0377221716304349-gr5.jpg https://s3.amazonaws.com/prod-ucs-content-store-us-east/content/pii:S0377221716304349/gr5/DOWNSAMPLED/image/jpeg/986e0af8e9b2a8f433665f48d4cec3cb/gr5.jpg gr5 gr5.jpg jpg 22255 221 384 IMAGE-DOWNSAMPLED 1-s2.0-S0377221716304349-si10.gif https://s3.amazonaws.com/prod-ucs-content-store-us-east/content/pii:S0377221716304349/STRIPIN/image/gif/2bd294cc65cd2fa091842928ccfc133d/si10.gif si10 si10.gif gif 253 24 22 ALTIMG 1-s2.0-S0377221716304349-si20.gif https://s3.amazonaws.com/prod-ucs-content-store-us-east/content/pii:S0377221716304349/STRIPIN/image/gif/95db423ecf7f3372ec2b68045b5cdc37/si20.gif si20 si20.gif gif 258 13 52 ALTIMG 1-s2.0-S0377221716304349-si30.gif https://s3.amazonaws.com/prod-ucs-content-store-us-east/content/pii:S0377221716304349/STRIPIN/image/gif/ab8b1bf95ee535e3dc722b6ad0542542/si30.gif si30 si30.gif gif 279 16 68 ALTIMG 1-s2.0-S0377221716304349-si40.gif https://s3.amazonaws.com/prod-ucs-content-store-us-east/content/pii:S0377221716304349/STRIPIN/image/gif/2ca8e37001f004b24fb2347b05f0b7f2/si40.gif si40 si40.gif gif 755 51 165 ALTIMG 1-s2.0-S0377221716304349-si50.gif https://s3.amazonaws.com/prod-ucs-content-store-us-east/content/pii:S0377221716304349/STRIPIN/image/gif/4e2d48ae888acc82d5b26336c4ef97cb/si50.gif si50 si50.gif gif 1578 19 516 ALTIMG 1-s2.0-S0377221716304349-si60.gif https://s3.amazonaws.com/prod-ucs-content-store-us-east/content/pii:S0377221716304349/STRIPIN/image/gif/b1728fcad6068aba709883fef5240049/si60.gif si60 si60.gif gif 540 22 118 ALTIMG 1-s2.0-S0377221716304349-si70.gif https://s3.amazonaws.com/prod-ucs-content-store-us-east/content/pii:S0377221716304349/STRIPIN/image/gif/b24a04886f63c0f4b070af310708890f/si70.gif si70 si70.gif gif 214 25 21 ALTIMG 1-s2.0-S0377221716304349-si80.gif https://s3.amazonaws.com/prod-ucs-content-store-us-east/content/pii:S0377221716304349/STRIPIN/image/gif/24a1e0abac7a6bf7f16d02bf40ea876d/si80.gif si80 si80.gif gif 1055 43 248 ALTIMG 1-s2.0-S0377221716304349-si90.gif https://s3.amazonaws.com/prod-ucs-content-store-us-east/content/pii:S0377221716304349/STRIPIN/image/gif/3516b5d05b2a6df87f4e7add9b527104/si90.gif si90 si90.gif gif 505 16 142 ALTIMG 1-s2.0-S0377221716304349-si100.gif https://s3.amazonaws.com/prod-ucs-content-store-us-east/content/pii:S0377221716304349/STRIPIN/image/gif/8d81f16827e5120c7468676f017b7236/si100.gif si100 si100.gif gif 453 16 154 ALTIMG 1-s2.0-S0377221716304349-si110.gif https://s3.amazonaws.com/prod-ucs-content-store-us-east/content/pii:S0377221716304349/STRIPIN/image/gif/f3404dd356a1683b1820ac0e2852cd49/si110.gif si110 si110.gif gif 514 24 118 ALTIMG 1-s2.0-S0377221716304349-si13.gif https://s3.amazonaws.com/prod-ucs-content-store-us-east/content/pii:S0377221716304349/STRIPIN/image/gif/6ce56b3d41b069c0cb38a2f7b16b7eec/si13.gif si13 si13.gif gif 1586 19 421 ALTIMG 1-s2.0-S0377221716304349-si14.gif https://s3.amazonaws.com/prod-ucs-content-store-us-east/content/pii:S0377221716304349/STRIPIN/image/gif/b7b625bbce4c8283da18b324e84f087d/si14.gif si14 si14.gif gif 389 18 72 ALTIMG 1-s2.0-S0377221716304349-si15.gif https://s3.amazonaws.com/prod-ucs-content-store-us-east/content/pii:S0377221716304349/STRIPIN/image/gif/66d9cd1bd8bd74b78d125f94ff5dccbe/si15.gif si15 si15.gif gif 370 18 67 ALTIMG 1-s2.0-S0377221716304349-si16.gif https://s3.amazonaws.com/prod-ucs-content-store-us-east/content/pii:S0377221716304349/STRIPIN/image/gif/2eedfe974ced5af9e5e1a308d8210626/si16.gif si16 si16.gif gif 387 18 72 ALTIMG 1-s2.0-S0377221716304349-si17.gif https://s3.amazonaws.com/prod-ucs-content-store-us-east/content/pii:S0377221716304349/STRIPIN/image/gif/54f23015ec4efb4d38898779db59a681/si17.gif si17 si17.gif gif 2226 48 464 ALTIMG 1-s2.0-S0377221716304349-si18.gif https://s3.amazonaws.com/prod-ucs-content-store-us-east/content/pii:S0377221716304349/STRIPIN/image/gif/94536a1768d7141c1434565316f25c34/si18.gif si18 si18.gif gif 376 14 92 ALTIMG 1-s2.0-S0377221716304349-si19.gif https://s3.amazonaws.com/prod-ucs-content-store-us-east/content/pii:S0377221716304349/STRIPIN/image/gif/4e165105cc40724fa0def1d59f114098/si19.gif si19 si19.gif gif 284 15 64 ALTIMG 1-s2.0-S0377221716304349-si2.gif https://s3.amazonaws.com/prod-ucs-content-store-us-east/content/pii:S0377221716304349/STRIPIN/image/gif/265dbc0af6a91c184edc4fbe431a90a9/si2.gif si2 si2.gif gif 387 16 88 ALTIMG 1-s2.0-S0377221716304349-si21.gif https://s3.amazonaws.com/prod-ucs-content-store-us-east/content/pii:S0377221716304349/STRIPIN/image/gif/93498b5ccd89dea29d809d3e5f494d92/si21.gif si21 si21.gif gif 472 16 153 ALTIMG 1-s2.0-S0377221716304349-si22.gif https://s3.amazonaws.com/prod-ucs-content-store-us-east/content/pii:S0377221716304349/STRIPIN/image/gif/614e6ec9abb8ac17f37ad04ae5520be8/si22.gif si22 si22.gif gif 569 16 194 ALTIMG 1-s2.0-S0377221716304349-si23.gif https://s3.amazonaws.com/prod-ucs-content-store-us-east/content/pii:S0377221716304349/STRIPIN/image/gif/a7818d92facc07e5bcb92f5b22141275/si23.gif si23 si23.gif gif 201 21 23 ALTIMG 1-s2.0-S0377221716304349-si24.gif https://s3.amazonaws.com/prod-ucs-content-store-us-east/content/pii:S0377221716304349/STRIPIN/image/gif/64fd1bb33f9590b7f60f6e0cbd65f5ad/si24.gif si24 si24.gif gif 183 13 43 ALTIMG 1-s2.0-S0377221716304349-si25.gif https://s3.amazonaws.com/prod-ucs-content-store-us-east/content/pii:S0377221716304349/STRIPIN/image/gif/5e2dcaaee83e41a749720f9227bd258f/si25.gif si25 si25.gif gif 199 21 23 ALTIMG 1-s2.0-S0377221716304349-si26.gif https://s3.amazonaws.com/prod-ucs-content-store-us-east/content/pii:S0377221716304349/STRIPIN/image/gif/9da1a4b2a68aaf33fb9fbaf0f3b73509/si26.gif si26 si26.gif gif 349 21 93 ALTIMG 1-s2.0-S0377221716304349-si27.gif https://s3.amazonaws.com/prod-ucs-content-store-us-east/content/pii:S0377221716304349/STRIPIN/image/gif/b2a8b1bf82f891ea5a42f03b5503f43a/si27.gif si27 si27.gif gif 861 21 292 ALTIMG 1-s2.0-S0377221716304349-si28.gif https://s3.amazonaws.com/prod-ucs-content-store-us-east/content/pii:S0377221716304349/STRIPIN/image/gif/82bc9cf1a19e241221467d2ae18c1dd2/si28.gif si28 si28.gif gif 293 21 79 ALTIMG 1-s2.0-S0377221716304349-si29.gif https://s3.amazonaws.com/prod-ucs-content-store-us-east/content/pii:S0377221716304349/STRIPIN/image/gif/15837cb4df0efc11f2d9e2158dbcf7f9/si29.gif si29 si29.gif gif 227 21 46 ALTIMG 1-s2.0-S0377221716304349-si3.gif https://s3.amazonaws.com/prod-ucs-content-store-us-east/content/pii:S0377221716304349/STRIPIN/image/gif/d3780772896f97c9ade17863d6ec288f/si3.gif si3 si3.gif gif 389 15 98 ALTIMG 1-s2.0-S0377221716304349-si31.gif https://s3.amazonaws.com/prod-ucs-content-store-us-east/content/pii:S0377221716304349/STRIPIN/image/gif/103d7ebeb104734ae6e0a30d3fd76f33/si31.gif si31 si31.gif gif 418 21 150 ALTIMG 1-s2.0-S0377221716304349-si32.gif https://s3.amazonaws.com/prod-ucs-content-store-us-east/content/pii:S0377221716304349/STRIPIN/image/gif/d1a10646ad549783fc3a85a62b209cef/si32.gif si32 si32.gif gif 596 45 97 ALTIMG 1-s2.0-S0377221716304349-si33.gif https://s3.amazonaws.com/prod-ucs-content-store-us-east/content/pii:S0377221716304349/STRIPIN/image/gif/d25021d9e0a1796847dcfdbb139110b0/si33.gif si33 si33.gif gif 424 16 119 ALTIMG 1-s2.0-S0377221716304349-si34.gif https://s3.amazonaws.com/prod-ucs-content-store-us-east/content/pii:S0377221716304349/STRIPIN/image/gif/b2194171dd6438cdd7801a284919f636/si34.gif si34 si34.gif gif 1240 44 351 ALTIMG 1-s2.0-S0377221716304349-si35.gif https://s3.amazonaws.com/prod-ucs-content-store-us-east/content/pii:S0377221716304349/STRIPIN/image/gif/a5a9e11921c83f73286e56d46ebcd6cc/si35.gif si35 si35.gif gif 1208 44 317 ALTIMG 1-s2.0-S0377221716304349-si36.gif https://s3.amazonaws.com/prod-ucs-content-store-us-east/content/pii:S0377221716304349/STRIPIN/image/gif/5395012ecd63920254190fdb58c0d57b/si36.gif si36 si36.gif gif 223 25 21 ALTIMG 1-s2.0-S0377221716304349-si37.gif https://s3.amazonaws.com/prod-ucs-content-store-us-east/content/pii:S0377221716304349/STRIPIN/image/gif/49e599ab9db1640bbaeb4f6f42ee75d2/si37.gif si37 si37.gif gif 804 50 132 ALTIMG 1-s2.0-S0377221716304349-si38.gif https://s3.amazonaws.com/prod-ucs-content-store-us-east/content/pii:S0377221716304349/STRIPIN/image/gif/efae8196411f367afd080367ab07f13c/si38.gif si38 si38.gif gif 825 50 157 ALTIMG 1-s2.0-S0377221716304349-si39.gif https://s3.amazonaws.com/prod-ucs-content-store-us-east/content/pii:S0377221716304349/STRIPIN/image/gif/32dc7097bacac266e33500bc2f408c07/si39.gif si39 si39.gif gif 1079 51 237 ALTIMG 1-s2.0-S0377221716304349-si4.gif https://s3.amazonaws.com/prod-ucs-content-store-us-east/content/pii:S0377221716304349/STRIPIN/image/gif/40f4caf799aa629bb0d908f959b4a61d/si4.gif si4 si4.gif gif 206 13 45 ALTIMG 1-s2.0-S0377221716304349-si41.gif https://s3.amazonaws.com/prod-ucs-content-store-us-east/content/pii:S0377221716304349/STRIPIN/image/gif/5014564cb4ddf81d7d0f2121b3fba8df/si41.gif si41 si41.gif gif 940 18 342 ALTIMG 1-s2.0-S0377221716304349-si42.gif https://s3.amazonaws.com/prod-ucs-content-store-us-east/content/pii:S0377221716304349/STRIPIN/image/gif/5e54dc2267603fc6bf4707260e1ad1bd/si42.gif si42 si42.gif gif 960 51 184 ALTIMG 1-s2.0-S0377221716304349-si43.gif https://s3.amazonaws.com/prod-ucs-content-store-us-east/content/pii:S0377221716304349/STRIPIN/image/gif/b25e1fff11f3fa2de6efc53b69843f09/si43.gif si43 si43.gif gif 794 43 166 ALTIMG 1-s2.0-S0377221716304349-si44.gif https://s3.amazonaws.com/prod-ucs-content-store-us-east/content/pii:S0377221716304349/STRIPIN/image/gif/ceed9ae3cfb4cb01af5576b0aef09c49/si44.gif si44 si44.gif gif 1604 51 346 ALTIMG 1-s2.0-S0377221716304349-si45.gif https://s3.amazonaws.com/prod-ucs-content-store-us-east/content/pii:S0377221716304349/STRIPIN/image/gif/4d8e29c9ed207b3077d588b762e37ba7/si45.gif si45 si45.gif gif 1338 24 412 ALTIMG 1-s2.0-S0377221716304349-si46.gif https://s3.amazonaws.com/prod-ucs-content-store-us-east/content/pii:S0377221716304349/STRIPIN/image/gif/29b831ccb6dd6eb3a7be886ba5f06b4b/si46.gif si46 si46.gif gif 753 19 217 ALTIMG 1-s2.0-S0377221716304349-si47.gif https://s3.amazonaws.com/prod-ucs-content-store-us-east/content/pii:S0377221716304349/STRIPIN/image/gif/2602d79784e6a3600c13e19e3dd13652/si47.gif si47 si47.gif gif 905 18 285 ALTIMG 1-s2.0-S0377221716304349-si48.gif https://s3.amazonaws.com/prod-ucs-content-store-us-east/content/pii:S0377221716304349/STRIPIN/image/gif/a349b94183ef3ffa21558db43a012d9b/si48.gif si48 si48.gif gif 1041 19 314 ALTIMG 1-s2.0-S0377221716304349-si49.gif https://s3.amazonaws.com/prod-ucs-content-store-us-east/content/pii:S0377221716304349/STRIPIN/image/gif/0d7dfe9872110c3773de358d2f965bb1/si49.gif si49 si49.gif gif 1257 19 406 ALTIMG 1-s2.0-S0377221716304349-si5.gif https://s3.amazonaws.com/prod-ucs-content-store-us-east/content/pii:S0377221716304349/STRIPIN/image/gif/042712e12626d3b20a9fc335802f19fa/si5.gif si5 si5.gif gif 559 24 123 ALTIMG 1-s2.0-S0377221716304349-si51.gif https://s3.amazonaws.com/prod-ucs-content-store-us-east/content/pii:S0377221716304349/STRIPIN/image/gif/f1e48541e8711cae16f35cdb8b8bb705/si51.gif si51 si51.gif gif 1588 19 516 ALTIMG 1-s2.0-S0377221716304349-si52.gif https://s3.amazonaws.com/prod-ucs-content-store-us-east/content/pii:S0377221716304349/STRIPIN/image/gif/e49e451d5dd6fd695860df4fbef0e233/si52.gif si52 si52.gif gif 1595 19 517 ALTIMG 1-s2.0-S0377221716304349-si53.gif https://s3.amazonaws.com/prod-ucs-content-store-us-east/content/pii:S0377221716304349/STRIPIN/image/gif/5d7aab3a845787f35e3aadb7d0c96656/si53.gif si53 si53.gif gif 1591 19 517 ALTIMG 1-s2.0-S0377221716304349-si54.gif https://s3.amazonaws.com/prod-ucs-content-store-us-east/content/pii:S0377221716304349/STRIPIN/image/gif/0fb1a3ea2e842bfe7f50cdd84f61508e/si54.gif si54 si54.gif gif 1542 19 514 ALTIMG 1-s2.0-S0377221716304349-si55.gif https://s3.amazonaws.com/prod-ucs-content-store-us-east/content/pii:S0377221716304349/STRIPIN/image/gif/8da792d5b5dde29b2b4197472886b96b/si55.gif si55 si55.gif gif 1552 19 514 ALTIMG 1-s2.0-S0377221716304349-si56.gif https://s3.amazonaws.com/prod-ucs-content-store-us-east/content/pii:S0377221716304349/STRIPIN/image/gif/cc771110c0d2d1dc9c1400488f163818/si56.gif si56 si56.gif gif 971 19 294 ALTIMG 1-s2.0-S0377221716304349-si57.gif https://s3.amazonaws.com/prod-ucs-content-store-us-east/content/pii:S0377221716304349/STRIPIN/image/gif/cf914e82cb075842e09b6ac3ac02ee75/si57.gif si57 si57.gif gif 1240 24 379 ALTIMG 1-s2.0-S0377221716304349-si58.gif https://s3.amazonaws.com/prod-ucs-content-store-us-east/content/pii:S0377221716304349/STRIPIN/image/gif/3c6bfbcd19945104b2c002bd2b6d0b65/si58.gif si58 si58.gif gif 866 19 267 ALTIMG 1-s2.0-S0377221716304349-si59.gif https://s3.amazonaws.com/prod-ucs-content-store-us-east/content/pii:S0377221716304349/STRIPIN/image/gif/fdfec9e23787a536f8694497b26d22a0/si59.gif si59 si59.gif gif 689 19 213 ALTIMG 1-s2.0-S0377221716304349-si6.gif https://s3.amazonaws.com/prod-ucs-content-store-us-east/content/pii:S0377221716304349/STRIPIN/image/gif/bae668d946be0b38a9f8ceb16b3394ad/si6.gif si6 si6.gif gif 874 18 225 ALTIMG 1-s2.0-S0377221716304349-si61.gif https://s3.amazonaws.com/prod-ucs-content-store-us-east/content/pii:S0377221716304349/STRIPIN/image/gif/d991de0ad88892122842757c9de64fe7/si61.gif si61 si61.gif gif 531 24 124 ALTIMG 1-s2.0-S0377221716304349-si62.gif https://s3.amazonaws.com/prod-ucs-content-store-us-east/content/pii:S0377221716304349/STRIPIN/image/gif/b6da30d143dc2ade42082ee932da84c1/si62.gif si62 si62.gif gif 1123 23 316 ALTIMG 1-s2.0-S0377221716304349-si63.gif https://s3.amazonaws.com/prod-ucs-content-store-us-east/content/pii:S0377221716304349/STRIPIN/image/gif/5dcaf08ba2acd06e8bb130668af29d4f/si63.gif si63 si63.gif gif 816 22 212 ALTIMG 1-s2.0-S0377221716304349-si64.gif https://s3.amazonaws.com/prod-ucs-content-store-us-east/content/pii:S0377221716304349/STRIPIN/image/gif/058306256a67fd0e6fd200ca17757e6c/si64.gif si64 si64.gif gif 836 22 211 ALTIMG 1-s2.0-S0377221716304349-si65.gif https://s3.amazonaws.com/prod-ucs-content-store-us-east/content/pii:S0377221716304349/STRIPIN/image/gif/ba4fa354061811a6808e7c1e50d6278c/si65.gif si65 si65.gif gif 1123 22 279 ALTIMG 1-s2.0-S0377221716304349-si66.gif https://s3.amazonaws.com/prod-ucs-content-store-us-east/content/pii:S0377221716304349/STRIPIN/image/gif/c63447c96aa9a98cf34b146952c7b287/si66.gif si66 si66.gif gif 251 25 28 ALTIMG 1-s2.0-S0377221716304349-si67.gif https://s3.amazonaws.com/prod-ucs-content-store-us-east/content/pii:S0377221716304349/STRIPIN/image/gif/c1a3be94afb4f2b664c2341712d5ed35/si67.gif si67 si67.gif gif 588 16 179 ALTIMG 1-s2.0-S0377221716304349-si68.gif https://s3.amazonaws.com/prod-ucs-content-store-us-east/content/pii:S0377221716304349/STRIPIN/image/gif/77e5756da2ac91ad6453baa4e902f2e3/si68.gif si68 si68.gif gif 237 25 23 ALTIMG 1-s2.0-S0377221716304349-si69.gif https://s3.amazonaws.com/prod-ucs-content-store-us-east/content/pii:S0377221716304349/STRIPIN/image/gif/bd88353868b62179b8de6b7c28f652d4/si69.gif si69 si69.gif gif 1310 27 330 ALTIMG 1-s2.0-S0377221716304349-si7.gif https://s3.amazonaws.com/prod-ucs-content-store-us-east/content/pii:S0377221716304349/STRIPIN/image/gif/c99c5e7612db7b2541691cec1501bd5f/si7.gif si7 si7.gif gif 400 16 88 ALTIMG 1-s2.0-S0377221716304349-si71.gif https://s3.amazonaws.com/prod-ucs-content-store-us-east/content/pii:S0377221716304349/STRIPIN/image/gif/7898bc941d6c6fb27efe668d87f18331/si71.gif si71 si71.gif gif 280 25 31 ALTIMG 1-s2.0-S0377221716304349-si72.gif https://s3.amazonaws.com/prod-ucs-content-store-us-east/content/pii:S0377221716304349/STRIPIN/image/gif/541efe947a3cdb9ddadeafdc60cdc7aa/si72.gif si72 si72.gif gif 1308 65 225 ALTIMG 1-s2.0-S0377221716304349-si73.gif https://s3.amazonaws.com/prod-ucs-content-store-us-east/content/pii:S0377221716304349/STRIPIN/image/gif/7194d155c3558aba842f2bd3ad5b549c/si73.gif si73 si73.gif gif 826 51 157 ALTIMG 1-s2.0-S0377221716304349-si74.gif https://s3.amazonaws.com/prod-ucs-content-store-us-east/content/pii:S0377221716304349/STRIPIN/image/gif/43bc417ffcf21bdcfefdbde8ffd58aae/si74.gif si74 si74.gif gif 728 43 159 ALTIMG 1-s2.0-S0377221716304349-si75.gif https://s3.amazonaws.com/prod-ucs-content-store-us-east/content/pii:S0377221716304349/STRIPIN/image/gif/97aaf23373752f4e67f553f632501e80/si75.gif si75 si75.gif gif 1082 51 231 ALTIMG 1-s2.0-S0377221716304349-si76.gif https://s3.amazonaws.com/prod-ucs-content-store-us-east/content/pii:S0377221716304349/STRIPIN/image/gif/91d2c6da9b61fce12731d0fb69851b0a/si76.gif si76 si76.gif gif 934 18 334 ALTIMG 1-s2.0-S0377221716304349-si77.gif https://s3.amazonaws.com/prod-ucs-content-store-us-east/content/pii:S0377221716304349/STRIPIN/image/gif/7b6c28c562f832bc25f678047a1ad99d/si77.gif si77 si77.gif gif 497 44 88 ALTIMG 1-s2.0-S0377221716304349-si78.gif https://s3.amazonaws.com/prod-ucs-content-store-us-east/content/pii:S0377221716304349/STRIPIN/image/gif/8a1e51c3abd24614440de8f810c506de/si78.gif si78 si78.gif gif 605 44 116 ALTIMG 1-s2.0-S0377221716304349-si79.gif https://s3.amazonaws.com/prod-ucs-content-store-us-east/content/pii:S0377221716304349/STRIPIN/image/gif/7cf60e24a13ab4b209931aa1030e7d85/si79.gif si79 si79.gif gif 771 44 151 ALTIMG 1-s2.0-S0377221716304349-si8.gif https://s3.amazonaws.com/prod-ucs-content-store-us-east/content/pii:S0377221716304349/STRIPIN/image/gif/ec2ce4957f022f5caa660d5735ad0e2c/si8.gif si8 si8.gif gif 271 15 60 ALTIMG 1-s2.0-S0377221716304349-si81.gif https://s3.amazonaws.com/prod-ucs-content-store-us-east/content/pii:S0377221716304349/STRIPIN/image/gif/ff3e00ab595b16e64fe25ccacd4025a2/si81.gif si81 si81.gif gif 1973 44 488 ALTIMG 1-s2.0-S0377221716304349-si82.gif https://s3.amazonaws.com/prod-ucs-content-store-us-east/content/pii:S0377221716304349/STRIPIN/image/gif/a87a9ac9887d922737ab25827008b394/si82.gif si82 si82.gif gif 1059 43 248 ALTIMG 1-s2.0-S0377221716304349-si83.gif https://s3.amazonaws.com/prod-ucs-content-store-us-east/content/pii:S0377221716304349/STRIPIN/image/gif/4565030c1c14eefb13590675cb0cc1e3/si83.gif si83 si83.gif gif 2052 43 529 ALTIMG 1-s2.0-S0377221716304349-si84.gif https://s3.amazonaws.com/prod-ucs-content-store-us-east/content/pii:S0377221716304349/STRIPIN/image/gif/f626a2173a4b974935742dc0f1c7b072/si84.gif si84 si84.gif gif 1438 24 432 ALTIMG 1-s2.0-S0377221716304349-si85.gif https://s3.amazonaws.com/prod-ucs-content-store-us-east/content/pii:S0377221716304349/STRIPIN/image/gif/7198abbbb5fddf100f8eea225f8c8df2/si85.gif si85 si85.gif gif 1027 56 235 ALTIMG 1-s2.0-S0377221716304349-si86.gif https://s3.amazonaws.com/prod-ucs-content-store-us-east/content/pii:S0377221716304349/STRIPIN/image/gif/c1eb5bffb4c9dd41fbf4927518e5bd41/si86.gif si86 si86.gif gif 1858 66 376 ALTIMG 1-s2.0-S0377221716304349-si87.gif https://s3.amazonaws.com/prod-ucs-content-store-us-east/content/pii:S0377221716304349/STRIPIN/image/gif/e92a67272d574e511728be841b8640f7/si87.gif si87 si87.gif gif 1348 24 430 ALTIMG 1-s2.0-S0377221716304349-si88.gif https://s3.amazonaws.com/prod-ucs-content-store-us-east/content/pii:S0377221716304349/STRIPIN/image/gif/0442a5d73ad4299408de5e7230d028e6/si88.gif si88 si88.gif gif 1588 24 449 ALTIMG 1-s2.0-S0377221716304349-si89.gif https://s3.amazonaws.com/prod-ucs-content-store-us-east/content/pii:S0377221716304349/STRIPIN/image/gif/92885588ddd995897dd42d87b11d2f2a/si89.gif si89 si89.gif gif 287 16 57 ALTIMG 1-s2.0-S0377221716304349-si9.gif https://s3.amazonaws.com/prod-ucs-content-store-us-east/content/pii:S0377221716304349/STRIPIN/image/gif/3c4aba3232c423edd6623950b134ab27/si9.gif si9 si9.gif gif 409 24 73 ALTIMG 1-s2.0-S0377221716304349-si91.gif https://s3.amazonaws.com/prod-ucs-content-store-us-east/content/pii:S0377221716304349/STRIPIN/image/gif/8a49d86e49a1e72a55942dbe62722dff/si91.gif si91 si91.gif gif 263 25 26 ALTIMG 1-s2.0-S0377221716304349-si92.gif https://s3.amazonaws.com/prod-ucs-content-store-us-east/content/pii:S0377221716304349/STRIPIN/image/gif/28d6c30485ec7fe95839ad51137b104e/si92.gif si92 si92.gif gif 238 22 25 ALTIMG 1-s2.0-S0377221716304349-si93.gif https://s3.amazonaws.com/prod-ucs-content-store-us-east/content/pii:S0377221716304349/STRIPIN/image/gif/a13811c9ee8c04b3fcee2814f12305d3/si93.gif si93 si93.gif gif 2368 79 380 ALTIMG 1-s2.0-S0377221716304349-si94.gif https://s3.amazonaws.com/prod-ucs-content-store-us-east/content/pii:S0377221716304349/STRIPIN/image/gif/11b0fc99a464bdec3a8d00b60a992ae7/si94.gif si94 si94.gif gif 488 27 78 ALTIMG 1-s2.0-S0377221716304349-si95.gif https://s3.amazonaws.com/prod-ucs-content-store-us-east/content/pii:S0377221716304349/STRIPIN/image/gif/18ec61aef35c3dea152f2f6ad17661b2/si95.gif si95 si95.gif gif 1350 66 254 ALTIMG 1-s2.0-S0377221716304349-si96.gif https://s3.amazonaws.com/prod-ucs-content-store-us-east/content/pii:S0377221716304349/STRIPIN/image/gif/3d1974be28c9e7fda8f5b7dd40e6ac51/si96.gif si96 si96.gif gif 1876 66 349 ALTIMG 1-s2.0-S0377221716304349-si97.gif https://s3.amazonaws.com/prod-ucs-content-store-us-east/content/pii:S0377221716304349/STRIPIN/image/gif/d9b880b4707183de8569acf1c1d92b14/si97.gif si97 si97.gif gif 2642 113 354 ALTIMG 1-s2.0-S0377221716304349-si98.gif https://s3.amazonaws.com/prod-ucs-content-store-us-east/content/pii:S0377221716304349/STRIPIN/image/gif/8e13d58bf9c1713bd1ed6d5b493d42ce/si98.gif si98 si98.gif gif 864 51 130 ALTIMG 1-s2.0-S0377221716304349-si99.gif https://s3.amazonaws.com/prod-ucs-content-store-us-east/content/pii:S0377221716304349/STRIPIN/image/gif/d32f807dd191973ae5133987448a27fa/si99.gif si99 si99.gif gif 2256 110 293 ALTIMG 1-s2.0-S0377221716304349-si101.gif https://s3.amazonaws.com/prod-ucs-content-store-us-east/content/pii:S0377221716304349/STRIPIN/image/gif/900d7bbac0054cfa227282685219e84e/si101.gif si101 si101.gif gif 238 16 56 ALTIMG 1-s2.0-S0377221716304349-si102.gif https://s3.amazonaws.com/prod-ucs-content-store-us-east/content/pii:S0377221716304349/STRIPIN/image/gif/e093639fca5c0386925f813d92753d09/si102.gif si102 si102.gif gif 226 13 52 ALTIMG 1-s2.0-S0377221716304349-si103.gif https://s3.amazonaws.com/prod-ucs-content-store-us-east/content/pii:S0377221716304349/STRIPIN/image/gif/06a38d54822caaa25b7f6710359110e3/si103.gif si103 si103.gif gif 220 13 51 ALTIMG 1-s2.0-S0377221716304349-si104.gif https://s3.amazonaws.com/prod-ucs-content-store-us-east/content/pii:S0377221716304349/STRIPIN/image/gif/d574780c83910ba309f38cd7b4c3dfc2/si104.gif si104 si104.gif gif 202 16 47 ALTIMG 1-s2.0-S0377221716304349-si105.gif https://s3.amazonaws.com/prod-ucs-content-store-us-east/content/pii:S0377221716304349/STRIPIN/image/gif/e9c7b343f4ec89e6bffb8b7dad612284/si105.gif si105 si105.gif gif 1032 29 234 ALTIMG 1-s2.0-S0377221716304349-si106.gif https://s3.amazonaws.com/prod-ucs-content-store-us-east/content/pii:S0377221716304349/STRIPIN/image/gif/c84fffec679e24a180d42339066ed607/si106.gif si106 si106.gif gif 568 27 117 ALTIMG 1-s2.0-S0377221716304349-si107.gif https://s3.amazonaws.com/prod-ucs-content-store-us-east/content/pii:S0377221716304349/STRIPIN/image/gif/8a0b1afadc4f6da7e1c59cd8e619b3bb/si107.gif si107 si107.gif gif 791 23 169 ALTIMG 1-s2.0-S0377221716304349-si108.gif https://s3.amazonaws.com/prod-ucs-content-store-us-east/content/pii:S0377221716304349/STRIPIN/image/gif/f726a6830fb426281caacd2a2303aa15/si108.gif si108 si108.gif gif 859 23 183 ALTIMG 1-s2.0-S0377221716304349-si109.gif https://s3.amazonaws.com/prod-ucs-content-store-us-east/content/pii:S0377221716304349/STRIPIN/image/gif/4261d7a82a73266e89a4712644016dd8/si109.gif si109 si109.gif gif 255 13 56 ALTIMG 1-s2.0-S0377221716304349-si11.gif https://s3.amazonaws.com/prod-ucs-content-store-us-east/content/pii:S0377221716304349/STRIPIN/image/gif/8423f1e13ca208fe62be5a67de58d032/si11.gif si11 si11.gif gif 820 26 172 ALTIMG 1-s2.0-S0377221716304349-si111.gif https://s3.amazonaws.com/prod-ucs-content-store-us-east/content/pii:S0377221716304349/STRIPIN/image/gif/73469d36ae2c1a2c41b4dbff650674f6/si111.gif si111 si111.gif gif 1504 31 378 ALTIMG 1-s2.0-S0377221716304349-si112.gif https://s3.amazonaws.com/prod-ucs-content-store-us-east/content/pii:S0377221716304349/STRIPIN/image/gif/0480b0cd4a502bd0404ac69100162366/si112.gif si112 si112.gif gif 227 13 46 ALTIMG 1-s2.0-S0377221716304349-si113.gif https://s3.amazonaws.com/prod-ucs-content-store-us-east/content/pii:S0377221716304349/STRIPIN/image/gif/9e1d52fa20432ff35c273533ce461e57/si113.gif si113 si113.gif gif 124 18 17 ALTIMG 1-s2.0-S0377221716304349-si114.gif https://s3.amazonaws.com/prod-ucs-content-store-us-east/content/pii:S0377221716304349/STRIPIN/image/gif/aadd7e5f93db08dda3712666cc757b3b/si114.gif si114 si114.gif gif 227 14 46 ALTIMG 1-s2.0-S0377221716304349-si115.gif https://s3.amazonaws.com/prod-ucs-content-store-us-east/content/pii:S0377221716304349/STRIPIN/image/gif/28eea8470cdb87367bdfbd333e523d26/si115.gif si115 si115.gif gif 225 16 51 ALTIMG 1-s2.0-S0377221716304349-si116.gif https://s3.amazonaws.com/prod-ucs-content-store-us-east/content/pii:S0377221716304349/STRIPIN/image/gif/7ab38cb5a50b9ada5b3710f8488896e2/si116.gif si116 si116.gif gif 256 16 60 ALTIMG 1-s2.0-S0377221716304349-si12.gif https://s3.amazonaws.com/prod-ucs-content-store-us-east/content/pii:S0377221716304349/STRIPIN/image/gif/a11cfff9e9ef685674333fdf1638959e/si12.gif si12 si12.gif gif 216 13 44 ALTIMG 1-s2.0-S0377221716304349-si1.gif https://s3.amazonaws.com/prod-ucs-content-store-us-east/content/pii:S0377221716304349/STRIPIN/image/gif/a08f75e169e04286b8952baba29e5344/si1.gif si1 si1.gif gif 64 9 11 ALTIMG EOR 13766 S0377-2217(16)30434-9 10.1016/j.ejor.2016.06.014 Elsevier B.V. Fig. 1 A distance matrix and its graph realization. Fig. 1 Fig. 2 A possible topology for a tree with 4 terminal nodes. Fig. 2 Fig. 3 A caterpillar tree. A possible topology for a tree with 8 terminal nodes. Fig. 3 Fig. 4 Two balanced trees. On the left, a possible topology for a tree with 7 terminal nodes. On the right, a possible topology for a tree with 8 terminal nodes. Fig. 4 Fig. 5 Performance profile. Fig. 5 Table 1 Computational results for data from the phylogenetics application. Table 1 Matrix |Vt | Path-weight formulation Path-edges formulation Path-edges + formulation PL4 T W GAP LB T DZ GAP GAP LB T w W T DZ GAP GAP LB T w W T DZ GAP GAP LB M391 5 0.219 0.0486 0 0.109 0.0473 31.52 0 0 0.0486 0 0.0473 0 0 0.031 0.0487 0.577 0.0473 0 0 6 0.499 0.0583 0 0.499 0.057 58.78 0 0.016 0.0591 0.078 0.057 0.34 0 0.031 0.0591 33.243 0.057 0.08 0 7 2.278 0.0626 0 2.793 0.0607 73.4 0 0.015 0.0634 1.919 0.0607 0.69 0 0.031 0.0634 328.021 0.0607 0.37 0 8 73.975 0.0693 0 58.141 0.0672 82.69 0 0.063 0.0698 6.49 0.0672 0.75 0 0.109 0.0698 >7200 \u2013 \u2013 \u2013 9 1003.18 0.0948 0 735.182 0.0923 90.14 0 0.14 0.0951 20.155 0.0923 0.6 0 0.172 0.0951 >7200 \u2013 \u2013 \u2013 10 >7200 0.1061 60.77 >7200 0.1027 94.29 36.08 0.655 0.1068 728.225 0.1027 1.04 0 7.691 0.1068 >7200 \u2013 \u2013 \u2013 11 >7200 0.1326 83.44 >7200 0.1289 96.78 59.67 18.658 0.134 2675.67 0.1276 1.18 0 14.929 0.1337 >7200 \u2013 \u2013 \u2013 12 >7200 0.1386 \u2013 >7200 0.1377 98.21 95.64 33.509 0.1449 >7200 1.322 1.21 0.84 77.532 0.1378 >7200 \u2013 \u2013 \u2013 13 >7200 0.1555 \u2013 >7200 0.1537 98.98 98.18 59.075 0.1658 >7200 0.1445 1.8 1.73 63.882 0.1523 >7200 \u2013 \u2013 \u2013 14 >7200 0.1607 \u2013 >7200 0.1603 99.42 99.1 108.95 0.1711 >7200 0.1481 2.34 2.27 306.4 0.1562 >7200 \u2013 \u2013 \u2013 15 >7200 0.1733 \u2013 >7200 0.1694 99.66 99.65 278.866 0.1813 >7200 0.156 3.82 3.75 417.815 0.1647 >7200 \u2013 \u2013 \u2013 Primate 5 0.25 0.843 0 0.218 0.0823 31.91 0 0 0.0843 0 0.0823 0 0 0 0.0843 1.42 0.0823 0 0 6 0.531 0.1059 0 0.452 0.1023 61.19 0 0.016 0.1059 0.031 0.1023 0 0 0.032 0.1059 67.907 0.1023 0 0 7 1.841 0.1272 0 1.732 0.1232 72.54 0 0.031 0.1272 0.406 0.1232 0.37 0 0.046 0.1272 507.906 0.1232 0 0 8 25.943 0.128 0 23.041 0.1229 80.3 0 0.063 0.128 2.294 0.1229 0.38 0 0.094 0.128 >7200 \u2013 \u2013 \u2013 9 228.697 0.1296 0 211.802 0.1246 87.11 0 0.14 0.1296 17.768 0.1246 3.03 0 0.188 0.1296 >7200 \u2013 \u2013 \u2013 10 >7200 0.1297 6.5 >7200 0.122 91.98 10.62 0.531 0.1298 107.593 0.122 2.45 0 19.16 0.1298 >7200 \u2013 \u2013 \u2013 11 >7200 0.17 72.41 >7200 0.1652 95.88 52.35 15.787 0.1762 1.356.95 0.1625 2.3 0 34.413 0.17 >7200 \u2013 \u2013 \u2013 12 >7200 0.2076 96.68 >7200 0.2019 97.62 76.03 29.125 0.212 >7200 0.1959 2.23 1.54 75.426 0.2058 >7200 \u2013 \u2013 \u2013 M887 5 0.219 0.1033 0 0.218 0.0972 29.56 0 0 0.1033 0 0.0971 0 0 0 0.1033 0.125 0.0972 0 0 6 0.499 0.1157 0 0.546 0.1098 57.62 0 0.015 0.1201 0.5 0.1098 1.88 0 0.078 0.1201 64.788 0.1098 0.42 0 7 2.121 0.1364 0 1.965 0.1292 71.56 0 0.016 0.1364 1.263 0.1292 1.52 0 0.047 0.1364 608.917 0.1292 0 0 8 63.945 0.1756 0 41.917 0.1619 82.73 0 0.063 0.1763 5.975 0.1619 1.52 0 0.094 0.1763 >7200 0.188 14.14 14.01 9 742.375 0.1823 0 487.235 0.1685 89.37 0 0.125 0.186 24.102 0.1685 1.7 0 0.172 0.186 >7200 \u2013 \u2013 \u2013 10 >7200 0.2026 50.69 >7200 0.1859 93.75 30.69 0.609 0.2059 220.412 0.1859 2.11 0 18.954 0.2059 >7200 \u2013 \u2013 \u2013 11 >7200 0.2113 81.2 >7200 0.196 96.50 0 60.25 0.2168 1960.88 0.1938 2.57 0 15.038 0.2135 >7200 \u2013 \u2013 \u2013 12 >7200 0.2184 \u2013 >7200 0.2058 98.95 94.65 33.041 0.2259 >7200 0.1967 2.71 2.59 72.961 0.2179 >7200 \u2013 \u2013 \u2013 13 >7200 0.2395 \u2013 >7200 0.2292 98.94 97.84 56.098 0.2562 >7200 0.2172 4.4 4.31 146.999 0.238 >7200 \u2013 \u2013 \u2013 14 >7200 0.2512 \u2013 >7200 0.2519 99.45 99.09 136.344 0.2829 >7200 0.2304 8.1 8.03 252.018 0.2543 >7200 \u2013 \u2013 \u2013 15 >7200 0.2787 \u2013 >7200 0.2602 99.66 99.65 207.262 0.2922 >7200 0.2664 14.34 14.29 953.521 0.304 >7200 \u2013 \u2013 \u2013 Table 2 Computational results for data from the networking application. Table 2 Matrix |Vt | Path-weight formulation Path-edges formulation Path-edges + formulation PL4 T W GAP LB T DZ GAP GAP LB T w W T DZ GAP GAP LB T w W T DZ GAP GAP LB Sim7 5 0.22 0.4043 0 0.296 0.4043 28.13 0 0 0.4043 0.016 0.4043 0 0 0.015 0.4043 0.16 0.4043 0 0 6 0.28 0.4348 0 0.858 0.4347 49.88 0 0 0.4348 0.031 0.4347 0 0 0.296 0.4348 23.845 0.4347 0 0 7 1.872 0.5055 0 2.808 0.5054 67.91 0 0.031 0.5055 0.047 0.5054 0 0 0.031 0.5055 4181.93 0.5054 0 0 Sim15 5 0.3 0.1893 0 0.515 0.1893 34.45 0 0 0.1893 0 0.1893 0 0 0.015 0.1893 0.124 0.1893 0 0 6 0.26 0.2756 0 1.138 0.2756 57.34 0 0.016 0.2756 0.047 0.2756 0 0 0.015 0.2756 118.092 0.2756 0 0 7 1.286 0.3013 0 1.748 0.3016 66.47 0 0.016 0.3013 0.53 0.3013 1.55 0 0.047 0.3013 8.056 0.3013 0 0 8 31.692 0.3778 0 18.189 0.3778 79.30 0 0.063 0.3778 9.672 0.3778 2.69 0 0.125 0.3778 >7200 \u2013 \u2013 \u2013 9 309.517 0.3932 0 122.663 0.3932 86.48 0 0.156 0.3932 13.307 0.3932 2.61 0 0.203 0.3932 >7200 \u2013 \u2013 \u2013 10 >7200 0.4286 33.44 4726.98 0.4286 91.81 0 0.406 0.4286 155.048 0.4286 3.16 0 18.58 0.4286 >7200 \u2013 \u2013 \u2013 11 >7200 0.626 60.31 >7200 0.626 95.94 51.79 13.478 0.626 1625.24 0.626 2.22 0 32.926 0.626 >7200 \u2013 \u2013 \u2013 12 >7200 0.722 94.74 >7200 0.727 97.64 94.99 30.311 0.7322 >7200 0.722 1.93 1.73 67.579 0.722 >7200 \u2013 \u2013 \u2013 13 >7200 0.8085 \u2013 >7200 0.7918 98.54 97.44 38.142 0.8188 >7200 0.7474 7.09 2.45 82.571 0.7474 >7200 \u2013 \u2013 \u2013 14 >7200 0.8845 \u2013 >7200 0.9796 99.26 98.82 146.531 1.0875 >7200 0.8335 14.16 12.65 281.939 0.8742 >7200 \u2013 \u2013 \u2013 15 >7200 0.9804 \u2013 >7200 1.1557 99.61 99.37 172.099 1.2949 >7200 0.9859 15.31 14.72 823.027 1.0418 >7200 \u2013 \u2013 \u2013 Sim20 5 0.203 0.299 0 0.328 0.299 0 0 0 0.299 0 0.299 0 0 0 0.299 0.109 0.299 0 0 6 0.187 0.3394 0 0.796 0.3394 57.39 0 0.015 0.3394 0.031 0.3394 0 0 0.031 0.3394 0.842 0.3394 0 0 7 1.825 0.3751 0 1.747 0.3751 70.65 0 0.31 0.3751 0.14 0.3751 3.72 0 0.031 0.3751 8.973 0.3751 3.24 0 8 46.722 0.4564 0 31.496 0.4564 81.78 0 0.078 0.4564 8.112 0.4564 3.53 0 0.094 0.4564 >7200 \u2013 \u2013 \u2013 9 581.085 0.5174 0 376.226 0.5173 88.40 0 0.172 0.5174 32.199 0.5174 3.3 0 0.218 0.5174 >7200 \u2013 \u2013 \u2013 10 >7200 0.5736 48.81 >7200 0.5736 92.98 23.97 0.609 0.5736 434.664 0.5736 2.89 0 19.078 0.5736 >7200 \u2013 \u2013 \u2013 11 >7200 0.609 69.97 >7200 0.609 95.72 49.69 18.938 0.609 1652.79 0.609 2.72 0 15.35 0.609 >7200 \u2013 \u2013 \u2013 12 >7200 0.6347 98.44 >7200 0.6373 97.55 76.05 36.208 0.645 >7200 0.6244 2.83 0 85.488 0.6244 >7200 \u2013 \u2013 \u2013 13 >7200 0.7515 \u2013 >7200 0.7657 98.71 98.39 70.06 0.7824 >7200 0.7301 2.79 2.17 146.952 0.7301 >7200 \u2013 \u2013 \u2013 14 >7200 0.8481 \u2013 >7200 0.9027 99.33 98.88 104.567 0.9674 >7200 0.7915 3.22 2.7 732.016 0.7967 >7200 \u2013 \u2013 \u2013 15 >7200 1.0057 \u2013 >7200 1.0633 99.65 99.64 282.391 1.1268 >7200 0.9012 4.26 3.82 958.435 0.914 >7200 \u2013 \u2013 \u2013 Table 3 Number of instances solved within the time limit imposed. Table 3 Path-weight Path-edges Path-edges + PL4 28 29 38 18 Table 4 Average and standard deviation values for the computational time. Table 4 n Path-weight Path-edges Path-edges + PL4 5 average 0.25 0.28 0 0.42 standard deviation 0.04 0.14 0.01 0.52 6 average 0.38 0.71 0.12 51.54 standard deviation 0.15 0.26 0.29 45.58 7 average 1.87 2.13 0.72 940.63 standard deviation 0.34 0.52 0.73 1607.35 8 average 48.46 34.56 6.51 \u2013 standard deviation 20.51 15.97 2.77 \u2013 9 average 572.97 386.62 21.51 \u2013 standard deviation 316.93 240.81 7.14 \u2013 Table 5 Average and standard deviation values for the GAP. Table 5 n Path-edges Path-edges + PL4 5 average 25.93 0.31 0 standard deviation 12.88 0.77 0 6 average 57.03 0.27 0.08 standard deviation 3.8 0.51 0.17 7 average 70.42 1.31 0.6 standard deviation 2.71 1.33 1.3 8 average 81.36 1.81 \u2013 standard deviation 1.52 1.31 \u2013 9 average 88.3 2.63 \u2013 standard deviation 1.52 0.54 \u2013 10 average 92.96 2.42 \u2013 standard deviation 1.08 0.82 \u2013 11 average 96.16 2.23 \u2013 standard deviation 0.45 0.63 \u2013 12 average 97.99 2.52 \u2013 standard deviation 0.6 1.2 \u2013 13 average 98.79 4.95 \u2013 standard deviation 0.21 3.11 \u2013 14 average 99.37 8.52 \u2013 standard deviation 0.09 6.63 \u2013 15 average 99.65 5.85 \u2013 standard deviation 0.02 6.59 \u2013 Table 6 Average and standard deviation values for the GAP LB . Table 6 n Path-weight Path-edges Path-edges + 10 average 40.04 92.96 0 standard deviation 21.15 1.08 0 11 average 73.47 96.16 0 standard deviation 9.3 0.45 0 12 average 96.62 97.99 2.52 standard deviation 1.85 0.6 1.2 13 average \u2013 98.79 4.95 standard deviation \u2013 0.21 3.11 14 average \u2013 99.37 8.52 standard deviation \u2013 0.09 6.63 15 average \u2013 99.65 5.85 standard deviation \u2013 0.02 6.59 Innovative Applications of O.R. Compact mixed integer linear programming models to the minimum weighted tree reconstruction problem Bernard Fortz a Olga Oliveira b Cristina Requejo \u204e b a Department of Computer Science, Universit\u00e9 Libre de Bruxelles, B-1050 Brussels, Belgium and INOCS, INRIA Lille Nord-Europe, France Department of Computer Science Universit\u00e9 Libre de Bruxelles B-1050 Brussels, Belgium and INOCS, INRIA Lille Nord-Europe France b Department of Mathematics, University of Aveiro, Aveiro 3810-193, Portugal Department of Mathematics University of Aveiro Aveiro 3810-193 Portugal \u204e Corresponding author. Tel.: +351 963621692. The Minimum Weighted Tree Reconstruction (MWTR) problem consists of finding a minimum length weighted tree connecting a set of terminal nodes in such a way that the length of the path between each pair of terminal nodes is greater than or equal to a given distance between the considered pair of terminal nodes. This problem has applications in several areas, namely, the inference of phylogenetic trees, the modeling of traffic networks and the analysis of internet infrastructures. In this paper, we investigate the MWTR problem and we present two compact mixed-integer linear programming models to solve the problem. Computational results using two different sets of instances, one from the phylogenetic area and another from the telecommunications area, show that the best of the two models is able to solve instances of the problem having up to 15 terminal nodes. Keywords Mixed integer linear programming Tree realization Topology discovery Routing topology inference Minimum evolution problem 1 Introduction We address the problem of reconstructing a weighted tree T = ( V , E ) by knowing only pairwise distances dij , for all i, j \u2208 Vt , between a set of terminal nodes Vt \u2282 V. Given a set Vt of n terminal nodes and an n \u00d7 n distance matrix D, find a tree T = ( V , E ) spanning V = V t \u222a V a , where Va is a subset of n \u2212 2 additional nodes, and associate edge weights we , e \u2208 E, such that the weight of the unique path Pij between any two terminal nodes i and j \u2208 Vt is at least dij , i.e. \u2211 e \u2208 P i j w e \u2265 d i j , and such that the total sum of the edge weights \u2211{i, j} \u2208 E wij is minimized. This problem is the Minimum Weighted Tree Reconstruction (MWTR) Problem. The MWTR problem is a specific version of the distance realization problem (which is a graph realization problem), namely a tree realization problem for a distance matrix. Several authors studied the tree realization problem for a distance matrix and this class of combinatorial problems was proved to be NP-complete (Chung, Garrett, Graham, & Shallcross, 2001; Day, 1987; Farach, Kannan, & Warnow, 1995). Fiorini and Joret (2012) and Catanzaro, Aringhieri, Summa, and Pesenti (2015) discuss the NP-hardness of two related optimization problems, the minimum evolution problem (MEP) and the balanced minimum evolution problem (BMEP). These two problems are very well known distance realization problems from the computational biology area. The MWTR arises in a number of areas, such as telecommunications and computational biology. All the applications we consider have in common the notion of a graph realization of a distance matrix and more specific of a tree realization of an additive distance matrix. A distance matrix has a tree realization, if it is an additive matrix and can be embedded into a tree. Abdi (1990) mentions several applications from these \u201cadditive trees that are used to represent objects as leaves such that the distance on the tree between two leaves reflects the similarity between the objects\u201d. Probably the most well know application is, in computational biology, the reconstruction of phylogenetic trees (Catanzaro, 2009; Felsenstein, 2004; Huson & Scornavacca, 2011). There are also applications in psychology (Corter & Tversky, 1986; Cunningham, 1980; Gilmore, Hersh, Caramazza, & Griffin, 1979; Sattath & Tversky, 1977; Soete, 1983) to represent cognitive processes or proximity and similarity relations. There are applications in information security for the detection and recognition of documents duplications (Dias, Rocha, & Goldenstein, 2012; Gilmore et al., 1979). And there are applications in telecommunications, namely in network tomography to discover the logical underlying network (Chung et al., 2001; Coates, Rabbat, & Nowak, 2003; Donnet & Friedman, 2007; Ni, Xie, Tatikonda, & Yang, 2008) and the routing topology of a network (Bhamidi, Rajagopal, & Roch, 2010; Chung et al., 2001; Donnet & Friedman, 2007; Haddadi, Rio, Iannaccone, Moore, & Mortier, 2008). In this work we use data from the two applications, the phylogenetics application and the network application, that will be described. An application of the MWTR includes in computational biology the reconstruction of phylogenetic trees. A phylogenetic tree represents the evolutionary relationships of a set of species, where terminal nodes represent the observed species, additional nodes represent common ancestors, edges represent the evolutionary relationships between pairs of nodes and edge weights represent the quantification of this evolutionary relationship (Felsenstein, 2004; Mount, 2001; Nei & Kumar, 2000). It is worth noting that phylogenetic trees allow understanding of the evolutionary history of species and can assist in the development of vaccines (Gaschen et al., 2002) and the study of biodiversity (Junker & Schreiber, 2008). In computational biology inferring a phylogenetic tree is one of the steps of the phylogenetic reconstruction. As part of such inference is the determination of the tree topology and the determination of the branch lengths, which requires further analysis methods. Such analysis methods includes parsimony methods, distance methods, and probabilistic methods arising from the maximum likelihood approach. These methods make specific assumptions about evolution. Distance methods exploit the existence of a measure of dissimilarity (also called distance) among pairs of species and aim at determining the tree topology together with branch lengths. Examples of distance methods assumptions are the minimum evolution principle and the balanced minimum evolution principle. In the minimum evolution principle the sum of all branch lengths is minimized (Nei & Kumar, 2000). This is the principle used in MEP. The balanced minimum evolution principle is a new version of the minimum evolution principle. This new version was first introduced by Pauplin (2000) to simplify tree length computations. Within this principle sibling subtrees have equal weight, as opposed to the standard version where all terminal nodes have the same weight and thus the weight of a subtree is equal to the number of its terminal nodes. This is the principle used in BMEP. Another application of the MWTR includes in telecommunications the inference of the underlying network. The reconstruction of the telecommunications network includes the determination of the underlying network topology as part of the network tomography process. The internet is a collection of interconnected networks, and its topology is unknown because of its decentralized and unregulated growth. In network tomography the knowledge of the underlying routing within some (unknown) network topology is important to develop more sophisticated and ambitious traffic control protocols and dynamic routing algorithms. Ni and Tatikonda (2011) propose \u201ca general framework for designing and analyzing topology and link performance inference algorithms using ideas and tools from phylogenetic inference in evolutionary biology. The framework is built upon additive metrics. Under an additive metric the path metric (path length) is expressed as the summation of the link metrics (link lengths) along the path. The basic idea is to use (estimated) distances between the terminal nodes (end hosts) to infer the routing tree topology and link metrics\u201d. Chung et al. (2001) investigate distance realization problems, a class of problems which, in their words, arise in the study of internet data traffic models and refer the construction of trees to infer the logical network topology. There are several techniques to reconstruct a network topology. For instance, one such technique can use ICMP (Internet Control Message Protocol) commands such as ping and traceroute (Donnet, 2013; Donnet, Raoult, Friedman, & Crovella, 2006; Govindan & Tangmunarunkit, 2000). However, these techniques require the cooperation of all the internal network devices, which is, most of the time, not possible, due to political and security issues. Another way to infer the routing network topology is to use tomographic techniques. These techniques only use end-to-end network measurements, such as loss measurements or delay variance. The end-to-end network measurements can be obtained using multicast (Duffield, Horowitz, Presti, & Towsley, 2002; Duffield, Horowitz, & Prestis, 2001; Ni et al., 2008) or unicast probing (Coates et al., 2002; Eriksson, Dasarathy, Barford, & Nowak, 2010; Shih & Hero, 2007). With this limited information only the logical topology can be inferred. The logical topology is obtained from the physical topology, representing only the physical devices on the network where traffic branching occurs and joining all the connections between these devices by a single logical link. The key idea is to use measurements at pairs of receivers to identify the logical topology defined by the branching points between paths to different receivers. In network design the terminal nodes represent the receivers, additional nodes represent physical devices where traffic branching occurs, edges represent relationships between pair of nodes and edges weights represent the quantification of some evolving connection property, like the delay or packet losses, for which end-to-end network measurements can be obtained. As already mentioned, all these applications have in common the notion of a graph realization of a distance matrix (Abdi, 1990). Over the years several authors studied the characteristics of the distance matrix and its graph and tree realization (Edelberg, Garey, & Graham, 1976; Hakimi & Patrinos, 1972; Koolen & Moulton, 2009; Sim\u00f5es-Pereira, 1987, 1990; Sim\u00f5es-Pereira & Zamfirescu, 1982; Varone, 1998; 2006). Hakimi and Yau (1965) were the first to refer, in 1965, the graph realization problem of a distance matrix and presented an algorithm for the special case where the realization of the matrix is a tree. Consider a n \u00d7 n positive, symmetric matrix D, where the diagonal elements are zero, and every entry dij > 0, \u2200i, j \u2208 Vt, i \u2260 j, represents the distance between terminal node i and terminal node j. In addition, if the elements of the matrix satisfy the triangle inequality d i j \u2264 d i k + d k j , \u2200 i , j , k \u2208 V t , then the matrix D is called a distance matrix and has a graph realization (Isaev, 2006; Varone, 1998). The graph realization problem (Chung et al., 2001) can be stated as follows. Given a distance matrix D of dimension n, representing distances between a set of n objects, determine a edge-weighted connected graph G = ( V , E ) with node set V, |V| > n, containing a subset Vt \u2282 V, with | V t | = n terminal nodes (each node representing an object), and the value dij in matrix D satisfying d i j G = d i j , where d i j G denotes the length of the shortest path in G between terminal node i and terminal node j, i, j \u2208 Vt . If such a graph exists then the distance matrix D has a realization. This means a metric given by the distance matrix D must be embedded into a graph. Associated with this existence problem is the optimization problem that determines a graph such that the sum of all edge weights of G is minimized. Among all the realizations of the distance matrix D, the one having the minimum total length is optimal (Chung et al., 2001). For a general distance matrix an optimal realization exists (Dress, 1984), however computing optimal realizations is hard, even for a small number of terminal nodes (Chung et al., 2001). Chung et al. (2001) formulate several versions of the distance matrix realization problem, mention relevant results, discuss their algorithmic implications, present approximation results and several heuristics. Because the realization problem is hard even to approximate, Chung et al. (2001) and Farach et al. (1995) introduce a weak realization of a distance matrix. A distance matrix D has a weak realization if there is a graph G whose node set contains node set Vt and the distance d i j G in the graph G between nodes i and j is greater than or equal to dij . For a given distance matrix with n terminal nodes, the distance, in the graph to be built, between two terminal nodes must be the minimal possible. Such a graph which is a weak realization for D must be a tree (Chung et al., 2001). Since the weak realization is a tree, for a set of n terminal nodes, there can be at most n \u2212 2 additional nodes of degree exactly three. Even when restricting the topologies to binary unrooted trees, there are ( 2 n \u2212 5 ) ! ! = ( 2 n \u2212 5 ) ! 2 n \u2212 3 ( n \u2212 3 ) ! different possible topologies (Cavalli-Sforza & Edwards, 1967; Nei & Kumar, 2000). Hence there are finitely many topologies for a weak realization for D, and for each topology the problem of determining a weak realization can be formulated as a linear programming problem. To the best of our knowledge Catanzaro et al. (2015), Catanzaro, Labb\u00e9, Pesenti, and Salazar-Gonzal\u00e9z (2009) are the only authors to present (mixed integer) linear programming models for solving the problem. It is worth noting that although a distance matrix has a graph realization, not all distance matrices describe trees. To describe a tree the distance matrix must also be additive (Buneman, 1974), i.e. satisfy the four-point condition. In Fig. 1 we present a distance matrix and its graph realization. This distance matrix has no tree realization. Distances that fit exactly on a tree can be characterized by the following four-point condition that generalizes the triangle inequality (take k = \u2113 ) (1.1) d i j + d k \u2113 \u2264 max { d i k + d j \u2113 , d i \u2113 + d j k } , \u2200 i , j , k , \u2113 \u2208 V t . As a consequence of this condition, on any quartet i, j, k, \u2113 we have that of the three sums d i j + d k \u2113 , d i k + d j \u2113 and d i \u2113 + d j k , the largest two are equal. Distance matrices with this property are called additive, because the weights on the paths along the tree add up to the values in the distance matrix. The distance matrix represented in Fig. 1 does not satisfy the four-point condition, it is not additive. Buneman (1974) proved that a distance matrix can be represented by a tree if it is additive. For a tree with 4 terminal nodes, i, j, k, \u2113 (e.g. Fig. 2 ), it can be checked that the four-point condition (1.1) holds w i 1 + w 1 j + w k 2 + w 2 \u2113 \u2264 max { w i 1 + w 12 + w 2 k + w j 1 + w 12 + w 2 \u2113 , w i 1 + w 12 + w 2 \u2113 + w j 1 + w 12 + w 2 k } . with wij being the weights associate to each edge in the tree solution. The constructed trees can either be rooted or unrooted. We consider unrooted trees and all the contents in this work can be adapted to a rooted tree. Therefore, and for modeling purposes, we force the tree structure to be a unrooted binary tree, all the additional nodes to have degree exactly three and the terminal nodes to be the leaves. Restricting ourselves to such topologies will help us to deal with this combinatorial problem which is a weak realization problem. Enforcing this tree structure is not a restriction to the problem as any tree can be converted into a rooted binary tree, and vice-versa. Byun and Yoo (2006) present an algorithm to convert a tree into a binary tree by including dummy nodes. The root node can then be added at the middle point in the longest path of the tree. If this point is in the edge {i, j}, remove edge {i, j}, add the dummy root node r and edges {i, r} and {j, r}, one new edge inherits the weight of edge {i, j} and the other new edge has weight 0. If this point is in the node i, consider the edge {i, j} connecting two nodes and proceed as before. In this work we contribute with two compact mixed integer linear programming (MILP) formulations of the MWTR problem. Both formulations use flows to help with the definition of the tree topology, however each with a different underlying reconstructing idea. One formulation, the Path-weight formulation, produces a tree solution and the other formulation, the Path-edges formulation, constructs a balanced tree. A balanced tree is a tree with minimal diameter. The matrix defined using the obtained branch weights is such that its submatrix corresponding to the terminal nodes dominates the given distance matrix. The Path-weight formulation produces a tree solution to the MWTR problem, using additional flow variables to ensure connectivity. This formulation is inspired from Model 4 in Catanzaro et al. (2009). As reported in Catanzaro et al. (2009), the linear relaxation of this model has an objective value of zero. We strengthen the formulation by adding valid inequalities that cut off the zero-objective solutions. The Path-edges formulation produces a balanced tree solution of the MWTR problem and flows are defined between every pair of terminal nodes. In Catanzaro, Labb\u00e9, Pesenti, and Salazar-Gonzal\u00e9z (2012) a balanced tree is also considered. However, we use multicommodity flows to deal with connectivity and path lengths. Instead of minimizing the total sum of all edge weights, the objective function deals with the minimization of the total tree length. Comparatively to the formulations presented in Catanzaro et al. (2012), formulation Path-edges solves more instances to optimality and, for the instances not solved to optimality, obtains a better lower bound value in smaller computational time. This paper aims at developing tighter compact MILP formulations for the MWTR problem, without requiring the development of specialized algorithms. Our aim is not to compete with the state-of-the-art algorithms which is a very specialized branch-and-cut-and-price algorithm based on a formulation with an exponential number of variables. In Section 2, we present and discuss two mixed integer linear programming formulations for the MWTR problem and include valid equalities and inequalities which improve the performance of the second formulation. Section 3 is devoted to computational results and Section 4 concludes the paper. 2 Formulations In this section we present two Mixed Integer Linear Programming formulations of the MWTR problem. Consider a tree T = ( V , E ) spanning the set of nodes V = V a \u222a V t . Va is the set of additional or internal nodes and Vt is the set of terminal or external nodes. The pairwise distances between terminal nodes in Vt are given in distance matrix D. The tree topologies we consider are such that the additional nodes of the tree all have degree three. Any tree can be transformed into a tree where every additional node has degree three by adding \u201ddummy\u201d nodes and edges, as described in Byun and Yoo (2006). When | V t | = n , an unrooted tree has n \u2212 2 additional nodes and 2 n \u2212 3 edges. Without loss of generality, let V a = { 1 , \u2026 , n \u2212 2 } be the additional node set and V t = { n \u2212 1 , \u2026 , 2 n \u2212 2 } be the terminal node set. In feasible trees, the length of a path varies between the length of a caterpillar tree (the most imbalanced tree) and the length of the most balanced tree. In a caterpillar tree all additional nodes are consecutively connected forming the central path (e.g. Fig. 3 ). Thus all the additional nodes, but two, are connected to exactly one terminal node, and those two additional nodes are connected exactly to two terminal nodes. A binary balanced tree has the minimum possible maximum height (depth) and is such that the heights of the left and right subtrees differ by at most one and the left and the right subtrees are balanced. A balanced tree is a binary tree having the smallest diameter (e.g. Fig. 4 ) and therefore the shortest path length with consecutive additional nodes. This tree has the n terminal nodes pairwise connected to \u230a n 2 \u230b additional nodes, if n is even (e.g. Fig. 4, on the right), and if n is odd n \u2212 1 terminal nodes pairwise connected to \u230a n 2 \u230b additional nodes and 1 terminal node connected to an additional node (e.g. Fig. 4, on the left). Eliminating the terminal nodes from this balanced tree we obtain a tree with only additional nodes. The degree of the nodes of this new tree are distributed as follows: \u230a n 2 \u230b nodes have degree one, \u2308 n 2 \u2309 - \u230a n 2 \u230b nodes have degree two and n \u2212 2 \u2212 \u2308 n 2 \u2309 nodes have degree three. The shortest path with consecutive additional nodes is obtained by binding consecutively a node with degree one, to the nodes with degree three, to the node of degree two, if it exits, and to a node with degree one. The obtained path uses 1 + ( n \u2212 2 \u2212 \u2308 n 2 \u2309 ) + ( \u2308 n 2 \u2309 \u2212 \u230a n 2 \u230b ) + 1 = n \u2212 \u230a n 2 \u230b = \u2308 n 2 \u2309 additional nodes. Therefore any feasible solution contains a path with at least \u2308 n 2 \u2309 consecutive additional nodes. Additional nodes can be arbitrarily interchanged in a solution to our problem, without modifying the tree topology. This introduces a lot of symmetry in the problem. As any feasible solution to the problem contains a path with at least \u2308 n 2 \u2309 consecutive additional nodes, the numbering of additional nodes is arbitrary. To break some of that symmetry, we can assume this path is composed of edges { i , i + 1 } for additional nodes i = 1 , \u2026 , \u2308 n 2 \u2309 \u2212 1 , and force these edges to be present in any solution. Both formulations use the following variables. Binary variables xij, i \u2208 Va, j \u2208 V, i < j indicate whether edge {i, j} belongs to the tree solution, while continuous variables wij \u2265 0 represent the weight associated to edge {i, j}. 2.1 Path-weight formulation We seek a tree T and associated weights we , e \u2208 T, that provide a weak realization of distance matrix D. Consider the path Pij that connects terminal nodes i and j, i, j \u2208 Vt . By definition of a weak realization, (2.1) \u2211 e \u2208 P i j w e \u2265 d i j must hold. To ensure this, consider additional continuous variables uij , for all i , j \u2208 V , i \u2260 j , which indicate the length of the path between nodes i and j. In order to impose connectivity several approaches can be used. Usual approaches consists either in the inclusion of the subtour elimination inequalities (2.2) \u2211 i , j \u2208 S x i j \u2264 | S | \u2212 1 , S \u2282 V , S \u2260 \u2205 , | S | > 1 or in the inclusion of the cut-set inequalities (2.3) \u2211 i \u2208 S , j \u2208 S c x i j \u2265 1 , S \u2282 V , S \u2260 \u2205 , 0 \u2208 S . The linear relaxation of both models provide the same bound, however the number of inequalities increase exponentially with the size of the model. It is well known that in order to ensure connectivity/prevent circuits, instead of using one of the families of inequalities (2.2) and (2.3) with an exponential number of inequalities, one can use compact extended formulations (Magnanti & Wolsey, 1995). The most common are derived using either the well-known Miller\u2013Tucker\u2013Zemlin inequalities (Gouveia, 1995; Miller, Tucker, & Zemlin, 1960) or using stronger multicommodity flow formulations (Gouveia, 1996; Magnanti & Wolsey, 1995). In the formulation presented below we use multicommodity flows. Fixing additional node 1 as the root of the flow, we introduce binary flow variables y i j k for all k \u2208 Vt, i \u2208 Va, j \u2208 V with i < j, indicating whether edge {i, j} is used from i to j in the path from root node 1 to terminal node k. Let dmax \u2254 max {dij : i, j \u2208 Vt }. The formulation that minimizes the total edges weights and reconstructs an unrooted tree for the MWTR problem is as follows. Path-weight formulation m i n \u2211 i \u2208 V a \u2211 j \u2208 V j > i w i j subject to (2.4) \u2211 i \u2208 V a \u2211 j \u2208 V j > i x i j = 2 n \u2212 3 (2.5) \u2211 j \u2208 V j > i x i j + \u2211 j \u2208 V a i > j x j i = 3 , \u2200 i \u2208 V a (2.6) \u2211 i \u2208 V a j > i x i j = 1 , \u2200 j \u2208 V t (2.7) x i , i + 1 = 1 \u2200 i \u2208 V a , i = 1 , \u2026 , ( \u2308 n / 2 \u2309 \u2212 1 ) (2.8) \u2211 j \u2208 V a \u222a { k } j \u2260 1 y 1 j k = 1 , \u2200 k \u2208 V t (2.9) \u2211 i \u2208 V a y i k k = 1 , \u2200 k \u2208 V t (2.10) \u2211 i \u2208 V a i < j y i j k = \u2211 i \u2208 V a \u222a { k } i > j y j i k , \u2200 k \u2208 V t , \u2200 j \u2208 V a \u2216 { 1 } (2.11) y i j k \u2264 x i j , \u2200 k \u2208 V t , \u2200 i \u2208 V a , \u2200 j \u2208 V \u2216 { 1 } , j > i (2.12) u i j \u2265 d i j \u2200 i , j \u2208 V t , i < j (2.13) u i j \u2265 w i j \u2200 i \u2208 V a , \u2200 j \u2208 V t , i < j (2.14) d m a x x i j \u2265 w i j \u2200 i \u2208 V a , \u2200 j \u2208 V , i < j (2.15) w i j \u2265 u i j \u2212 d m a x ( 1 \u2212 x i j ) \u2200 i \u2208 V a , \u2200 j \u2208 V , i < j (2.16) w i j \u2265 u i k \u2212 u j k \u2212 d m a x ( 1 \u2212 x i j ) \u2200 i \u2208 V a , \u2200 j , k \u2208 V , i < j , j < k (2.17) w i j \u2265 u j k \u2212 u i k \u2212 d m a x ( 1 \u2212 x i j ) \u2200 i \u2208 V a , \u2200 j , k \u2208 V , i < j , j < k (2.18) w i j \u2265 u i k \u2212 u k j \u2212 d m a x ( 1 \u2212 x i j ) \u2200 i \u2208 V a , \u2200 j , k \u2208 V , i < k , k < j (2.19) w i j \u2265 u k j \u2212 u i k \u2212 d m a x ( 1 \u2212 x i j ) \u2200 i \u2208 V a , \u2200 j , k \u2208 V , i < k , k < j (2.20) w i j \u2265 u k i \u2212 u k j \u2212 d m a x ( 1 \u2212 x i j ) \u2200 i , k \u2208 V a , \u2200 j \u2208 V , i < j , k < i (2.21) w i j \u2265 u k j \u2212 u k i \u2212 d m a x ( 1 \u2212 x i j ) \u2200 i , k \u2208 V a , \u2200 j \u2208 V , i < j , k < i (2.22) x i j \u2208 { 0 , 1 } \u2200 i \u2208 V a , \u2200 j \u2208 V , i < j (2.23) y i j k \u2208 { 0 , 1 } \u2200 k \u2208 V t , \u2200 i \u2208 V a , \u2200 j \u2208 V , i < j (2.24) w i j \u2265 0 \u2200 i \u2208 V a , \u2200 j \u2208 V , i < j (2.25) u i j \u2265 0 \u2200 i , j \u2208 V , i < j Constraints (2.4)\u2013(2.7) define a spanning tree with all additional nodes with degree three and all terminal nodes with degree one. The cardinality constraints (2.4) ensure that there are 2 n \u2212 3 edges in the solution. Constraints (2.5) ensure that all additional nodes have degree three. Constraints (2.6) ensure that all terminal nodes have degree one. As already mentioned, to reduce the symmetry, we fix a path between the first additional nodes with constraints (2.7). Constraints (2.8)\u2013(2.10) are flow conservation constraints and constraints (2.11) are linking constraints between flow variables y i j k and topology variables xij . Constraints (2.12)\u2013(2.21) link edge weight variables wij and path length variables uij . Constraints (2.12) ensure a weak realization of the distance matrix. Constraints (2.13) establish a lower bound for variables uij , associated to the length of the path between an additional node i and an external node j, to be the value of the corresponding (edge) weight wij . Constraints (2.14) fix wij to 0 when edge {i, j} does not belong to the tree. Together with (2.13), constraints (2.15) impose that wij is equal to uij if edge {i, j} belongs to the tree. Constraints (2.16)\u2013(2.21) impose the triangle inequality for any order of the nodes i, j and k. The index specifications included in the constraints (2.16)\u2013(2.21) improve the performance of our formulation as they impose an order on the variables index. Constraints (2.22) to (2.25) are integrality and non-negativity constraints. Our formulation strengthens the Flow Model proposed in Catanzaro et al. (2009) by including lower bounds on the wij variables. 2.2 Path-edges formulation Pauplin (2000) developed a method to directly calculate the sum of all weights of a tree (the length of the tree) without having to explicitly determine its edge-weights. According to this method the tree length is given by \u2211 i , j \u2208 V t d i j 2 \u2212 z i j where zij indicates the number of edges in the path Pij between terminal nodes i and j. When d i j = \u2211 e \u2208 P i j w e , we have \u2211 i , j \u2208 V t d i j 2 \u2212 z i j = \u2211 i , j \u2208 V t \u2211 e \u2208 P i j w e 2 \u2212 z i j . As the weight we appears as many times as the number of paths Pij to which the edge e belongs to, it holds \u2211 i , j \u2208 V t d i j 2 \u2212 z i j = \u2211 e \u2208 E w e and for a weak realization we have \u2211 i , j \u2208 V t d i j 2 \u2212 z i j \u2264 \u2211 e \u2208 E w e and min \u2211 i , j \u2208 V t d i j 2 \u2212 z i j \u2264 min \u2211 e \u2208 E w e . Using binary variables p i j \u2113 , for all i, j \u2208 Vt, i < j and \u2113 \u2208 { 2 , 3 , \u2026 , ( n \u2212 1 ) } , specifying the number of edges of a path Pij between terminal nodes i and j, the expression \u2211 i , j \u2208 V t d i j 2 \u2212 z i j can be linearized. This relation and linearization process was already used in Catanzaro et al. (2012). The binary decision variables p i j \u2113 indicating whether the path Pij connecting terminal node i to terminal node j has (exactly) \u2113 edges. Therefore \u2211 i , j \u2208 V t d i j 2 \u2212 z i j = \u2211 i , j \u2208 V t d i j \u2211 \u2113 = 2 n \u2212 1 2 \u2212 \u2113 p i j \u2113 . Variables p i j \u2113 have the same interpretation as variables x i j \u2113 in Catanzaro et al. (2012). Besides these path variables p i j \u2113 , the binary topology variables xij and the weight variables wij , we consider flow variables. The binary flow variables f i j k \u2113 , for all i, j \u2208 Va \u222a {k, \u2113}, k, \u2113 \u2208 Vt, i \u2260 j and k < \u2113, indicate whether the flow traverses the edge {i, j} belonging to the path connecting terminal node k to terminal node \u2113 in the direction from node i to node j. The formulation that specifies the number of edges of a path between terminal nodes and reconstructs an unrooted tree for the MWTR problem is as follows. Path-edges formulation m i n \u2211 i \u2208 V t \u2211 j \u2208 V t j > i d i j \u2211 \u2113 = 2 n \u2212 1 2 \u2212 \u2113 \u00b7 p i j \u2113 subject to (2.26) \u2211 i \u2208 V a \u2211 j \u2208 V j > i x i j = 2 n \u2212 3 (2.27) \u2211 i \u2208 V a x i j = 1 , \u2200 j \u2208 V t (2.28) \u2211 j \u2208 V j > i x i j + \u2211 j \u2208 V a j < i x j i = 3 , \u2200 i \u2208 V a (2.29) x i , i + 1 = 1 \u2200 i \u2208 V a , i = 1 , \u2026 , ( \u2308 n / 2 \u2309 \u2212 1 ) (2.30) \u2211 j \u2208 V t x 1 j = 2 (2.31) \u2211 j \u2208 V t x ( n \u2212 2 ) j = 2 (2.32) \u2211 j \u2208 V t x i j \u2264 2 \u2200 i \u2208 V a (2.33) \u2211 i \u2208 V a f k i k \u2113 = 1 \u2200 k , \u2113 \u2208 V t , k < \u2113 (2.34) \u2211 j \u2208 { \u2113 } \u222a V a \u2216 { i } f i j k \u2113 \u2212 \u2211 j \u2208 { k } \u222a V a \u2216 { i } f j i k \u2113 = 0 \u2200 i \u2208 V a , k , \u2113 \u2208 V t , k < \u2113 (2.35) \u2211 i \u2208 V a f i \u2113 k \u2113 = 1 \u2200 k , \u2113 \u2208 V t , k < \u2113 (2.36) \u2211 h \u2208 { \u2113 } \u222a V a \u2216 { i } f j h k \u2113 \u2212 f i j k \u2113 \u2265 0 \u2200 i \u2208 V a \u222a { k } , j \u2208 V a , k , \u2113 \u2208 V t , k < \u2113 (2.37) f i j k \u2113 + f j i k \u2113 \u2264 x i j \u2200 i , j \u2208 V , \u2200 k , \u2113 \u2208 V t , i < j , k < \u2113 (2.38) \u2211 \u2113 = 2 n \u2212 1 p i j \u2113 = 1 \u2200 i , j \u2208 V t , i < j (2.39) 2 + \u2211 i \u2208 V a \u2211 j \u2208 V a j \u2260 i f i j k \u2113 = \u2211 i = 2 n \u2212 1 i \u00b7 p k \u2113 i \u2200 k , \u2113 \u2208 V t , k < \u2113 (2.40) x i j \u2208 { 0 , 1 } \u2200 i \u2208 V a , \u2200 j \u2208 V , i < j (2.41) p i j \u2113 \u2208 { 0 , 1 } \u2200 \u2113 \u2208 { 2 , 3 , \u2026 , n \u2212 1 } , \u2200 i , j \u2208 V t , i < j (2.42) f i j k \u2113 \u2208 { 0 , 1 } \u2200 i , j \u2208 V a \u222a { k , \u2113 } \u2200 k , \u2113 \u2208 V t , i \u2260 j , k < \u2113 Constraint (2.26) is the tree cardinality constraint and establishes that the number of edges in the tree is 2 n \u2212 3 . Constraints (2.27) establish that all the terminal nodes have degree one and constraints (2.28) force the additional nodes degree to be three. As above, we fix a path of additional nodes with constraints (2.29). Since the tree is unrooted, we know that there are two additional nodes which are adjacent to two terminal nodes. Therefore, to reduce symmetry, constraints (2.30) and (2.31) enforce those two additional nodes to be node 1 and node ( n \u2212 2 ) . Constraints (2.32) impose that an additional node is connected to, at most, two terminal nodes. Constraints (2.33)\u2013(2.35) are flow conservation constraints. Constraints (2.36) establish that if the flow sent from terminal node k to terminal node \u2113 passes through edge {i, j}, in the direction from node i to node j, then the flow passes through, at least, one edge between node j and a node different than node i. Constraints (2.37) are linking constraints between variables and impose that there can be no flow in edge {i, j} if it does not belong to the tree. Constraints (2.38) impose that variables p i j \u2113 assume value one for exactly one \u2113 in { 2 , 3 , \u2026 , ( n \u2212 1 ) } corresponding to the number of edges in the path between terminal nodes i and j. Constraints (2.39) relate variables f i j k \u2113 with variables p i j \u2113 . Using variables f i j k \u2113 we know exactly the number of edges in the path between terminal nodes k and \u2113. Using variables p k \u2113 i we also know exactly the number of edges in the path between terminal nodes k and \u2113 and that number must be exactly the same. Constraints (2.40), (2.41) and (2.42) are the integrality constraints. This second formulation uses the same idea in Catanzaro et al. (2012) to obtain the total tree edges length by the formulation designated by the authors as the Path-Length-4-Point (PL4). In Section 3 we will compare the formulations presented in this section with this PL4 formulation. After having reconstructed a unrooted tree with this formulation, the weights have to be assigned to the tree edges. This is accomplished by solving the following simple linear program. m i n \u2211 i \u2208 V a \u2211 j \u2208 V j > i w i j subject to \u2211 i \u2208 V a \u2211 j \u2208 V i < j w i j ( f i j k \u2113 + f j i k \u2113 ) \u2265 d k \u2113 \u2200 k , \u2113 \u2208 V t , k < \u2113 w i j \u2265 0 \u2200 i , j \u2208 V , i < j Using the flow variables, the path between each pair of terminal nodes is exactly known. This information is used to associate weights to the edges such that the total sum of the edges weights is minimized and the tree length between every pair of terminal nodes dominates (is greater than) the corresponding distance from the distance matrix D. In a tree there is exactly one path between every pair of terminal nodes and the path variables p i j \u2113 state there are \u2113, for some unique \u2113 \u2265 2, edges in the path between terminal nodes i and j. Therefore \u2211 \u2113 = 2 n \u2212 1 \u2113 p i j \u2113 is the number of edges in the path between terminal nodes i and j. By summing the number of edges of all paths and taking into account that some edges belong to more than one path we must have (2.43) 2 \u2211 i \u2208 V t \u2211 j \u2208 V t j > i \u2211 \u2113 = 2 n \u2212 1 2 \u2212 \u2113 \u2113 p i j \u2113 = 2 n \u2212 3 , as the number of edges in the tree is 2 n \u2212 3 . This is already stated in the formulation through constraint (2.26), however this equality reinforces this condition using the path variables. Huffman codes are optimal path-length sequences whose corresponding rooted binary tree determines a code. When producing optimal Huffman codes the key idea are these rooted binary trees represented as sequences of ascending path-lengths. A sequence of n path-lengths represents a binary tree with n leaves where each leaf represents a symbol in the code. Parker and Ram (1996) characterize these path-length sequences by establishing that these binary trees obey the property established by the Kraft equality, a special case of the Kraft inequality. These path-lengths can be compared to the distances from the tree realization problem. Therefore the nontrivial property of the path-length sequences in a rooted binary tree characterized with the Kraft equality can be borrowed by the MWTR problem and the following equality can be established: (2.44) \u2211 \u2113 = 2 n \u2212 1 \u2211 j \u2208 V t j > i 2 \u2212 \u2113 p i j \u2113 + \u2211 \u2113 = 2 n \u2212 1 \u2211 j \u2208 V t j < i 2 \u2212 \u2113 p j i \u2113 = 1 2 \u2200 i \u2208 V t The inclusion of the two equalities (2.43) and (2.44) improved the performance of the Path-edges formulation. Beside these two equalities the following valid inequalities presented in Catanzaro et al. (2012) can also be included. (2.45) \u2211 j \u2208 V t i < j p i j n \u2212 1 + \u2211 j \u2208 V t j < i p j i n \u2212 1 \u2264 2 \u2211 j \u2208 V t i < j p i j \u2113 + 2 \u2211 j \u2208 V t j < i p j i \u2113 \u2200 i \u2208 V t , \u2200 \u2113 \u2208 { 2 , 3 , \u2026 , n \u2212 2 } (2.46) \u2211 i \u2208 V t \u2211 j \u2208 V t j > i p i j n \u2212 1 \u2264 4 (2.47) \u2211 j \u2208 V t i < j \u2211 q = 2 \u2113 2 \u2113 \u2212 q p i j q \u2264 2 \u2113 \u2212 1 \u2212 1 \u2200 i \u2208 V t , \u2200 \u2113 \u2208 { 2 , 3 , \u2026 , \u230a n 2 \u230b } , n > 2 \u2113 \u2212 1 + 1 Inequalities (2.45) state that if a tree has a path of length n \u2212 1 then it also has a path of length n \u2212 2 , n \u2212 3 , \u2026 , 2 , inequality (2.46) indicates that a tree has at most four paths of length n \u2212 1 and inequalities (2.47) are a consequence of the Kraft equality. 3 Computational results Computational results will assess the quality of the Linear Programming (LP) solutions obtained with each formulation from Section 2 and the best lower and upper bounds achieved. The computational tests were performed on an Intel(R) Core(TM) i7-3770 CPU 3.40 Gigahertz processor and 16.0 Gigabyte of RAM. We present computational results for instances of the problem with a number of terminal nodes varying between 5 and 15, for a total of 55 instances. We use two sets of data instances, one set coming from a phylogenetics application, and the other one from a networking application. The first set of instances is available from http://pubsonline.informs.org/doi/suppl/10.1287/ijoc.1110.0455 Catanzaro et al. (2012). From this set we use three phylogenetic distance matrices, matrices M391, Primate and M887, with t = 15 , t = 12 and t = 15 taxa, respectively, and for each we vary the number of terminal nodes (taxa) between 5 and t, obtaining 30 instances. The data for the second set of instances were generated using the network-level simulator NS-3. We performed three simulations named Sim7, Sim15 and Sim20 with t = 7 , t = 15 and t = 15 terminal nodes, varying the number of terminal nodes between 5 and t obtaining 25 instances. The two formulations from Section 2 were implemented using the Mosel language and solved with FICO Xpress 7.1 FICO Xpress Optimization Suite (Xpress-IVE 1.23.00 64 bit, Xpress-Optimizer 23.01.03 and Xpress-Mosel 3.4.0). Path-edges formulation used together with the valid equalities (2.43) and (2.44) and inequalities (2.45), (2.46), (2.47) presented at the end of Section 2 is designated Path-edges + formulation. We compare the performance of the two formulations introduced in Section 2, Path-weight formulation and Path-edges formulation, and the Path-edges + formulation with the formulation PL4 from Catanzaro et al. (2012). Our implementation of PL4 considers all the valid inequalities presented in Catanzaro et al. (2012). The computational results are summarized in Tables 1 and 2 in which the first column, labeled Matrix, indicates the name of the matrix instance used and the second column, labeled |Vt |, indicates the size of the instance. The third, fourth and fifth columns concern the results of the Path-weight formulation, from the sixth to the eleventh columns the results of the Path-edges formulation are presented, from the twelfth to the seventeenth columns are the results of the Path-edges + formulation and the eighteenth, nineteenth, twentieth and twenty-first columns concern PL4 formulation. The columns labeled T show the execution time, in seconds, used to solve the instance and having a maximum runtime of 7200 seconds and for the Path-edges formulation and Path-edges + formulation, the columns labeled T w shows the execution time of the linear program solved to assign the weights. The columns labeled W and DZ present the optimum value obtained or the best value obtained having a runtime limit of 7200 seconds, where DZ stands for \u2211 k \u2208 V t \u2211 \u2113 \u2208 V t \u2113 > k d k \u2113 \u2211 i = 2 n \u2212 1 2 \u2212 i \u00b7 p k \u2113 i and W stands for \u2211 i \u2208 V a \u2211 j \u2208 V j > i w i j . The columns labeled GAP present the LP solution gap which is obtained as follows: G A P = U B \u2212 P L U B \u00d7 100 , where UB represents the best upper bound value obtained (or the optimum value) within the runtime of 7200 seconds and PL represents the value of the corresponding linear programming relaxation. The columns labeled GAP LB present the lower bound gap and is obtained as follows: G A P L B = U B \u2212 L B U B \u00d7 100 , where UB represents the best upper bound value obtained (or the optimum value) and LB the best lower bound value obtained within the runtime of 7200 seconds. The optimum solution within the time limit imposed is obtained in the following cases: \u2022 by the Path-weight formulation for all instances with n < 10 terminal nodes and for instance Sim15 with n = 10 ; \u2022 by the Path-edges formulation for all instances with n < 10 terminal nodes; \u2022 by the Path-edges + formulation for all instances with n < 12 terminal nodes; \u2022 by the PL4 formulation for all instances with n < 8 terminal nodes. To better check the improvements achieved we display in Table 3 the number of instances, among the total of 55 instances, for which the optimal solution was obtained, within the time limit imposed, when the model indicated is used. The Path-edges + formulation solves the instances substantially faster than the other formulations. In Fig. 5 , we compare the computational times in the form of a profile graph that displays the number of solved instances in a given time by each formulation. Comparing, in Tables 1 and 2, the columns labeled with W of the Path-weight formulation and of the Path-edges formulation we notice that for some instances from the phylogenetics application the values obtained are different. This is due to the fact that the obtained trees are different. The tree we obtain when minimizing \u2211 k \u2208 V t \u2211 \u2113 \u2208 V t \u2113 > k d k \u2113 \u2211 i = 2 n \u2212 1 2 \u2212 i \u00b7 p k \u2113 i is such that, when assigning its edges weights the equality \u2211 e \u2208 P i j w e = d i j does not hold. In that case we obtain a tree that minimizes \u2211 k \u2208 V t \u2211 \u2113 \u2208 V t \u2113 > k d k \u2113 \u2211 i = 2 n \u2212 1 2 \u2212 i \u00b7 p k \u2113 i but does not minimizes \u2211 i \u2208 V a \u2211 j \u2208 V j > i w i j (see column labeled DZ), as in this case it holds \u2211 k \u2208 V t \u2211 \u2113 \u2208 V t \u2113 > k d k \u2113 \u2211 i = 2 n \u2212 1 2 \u2212 i \u00b7 p k \u2113 i < \u2211 i \u2208 V a \u2211 j \u2208 V j > i w i j . When the optimal solution can not be found within the runtime limit imposed the Path-weight formulation obtains, on average, ten feasible solutions, the Path-edges + formulation obtains, on average, three feasible solutions and the PL4 formulation is unable to obtain feasible solutions within the runtime limit imposed, except for matrix M887 where for n = 8 this formulation obtained one feasible solution. The difference between the number of feasible solutions of the Path-weight formulation and of the Path-edges formulation is due to the fact that the only integer (binary) variables of the Path-weight formulation are those which identify the tree, whereas the Path-edges formulation only has integer (binary) variables. For instances with the same number of terminal nodes, Tables 4\u20136 display the average time, the average GAP and the average GAP LB , respectively, and their corresponding standard deviation values. Table 4 presents the values for instances with n \u2264 9, since for n > 9 only the Path-edges + obtains a feasible solution within the runtime limit imposed. Table 6 displays the values for the formulations Path-weight, Path-edges and Path-edge + , since the formulation PL4 does not obtain feasible solutions for n \u2265 10, and for instances with n \u2265 10 because for n < 10 the GAP LB is equal to zero (the optimal solution is achieved). Now we compare the results between the Path-edges formulation and the Path-edges + formulation. The Path-edges + formulation is substantially faster, for example for n = 9 it is eighteen times faster. The average GAP of the Path-edges formulation varies from 25.93%, for n = 5 , to 99.65%, for n = 15 , while the average GAP of the Path-edges + formulation does not exceed 9%. Finally, the average GAP LB of the Path-edges formulation is over 90% while for the Path-edges + formulation it does not exceed 9%. We may conclude that the equalities and inequalities included in the Path-edges formulation considerably improve the formulation. 4 Conclusion In this paper, we introduce two formulations for the minimum weighted tree reconstruction (MWTR) problem: the Path-weight formulation and the Path-edges formulation. Some valid equalities and inequalities are also introduced to strengthen the Path-edges formulation. Computational experiments performed on data sets coming from phylogenetics and networking applications show that the strengthened Path-edges formulation outperforms the previous formulations proposed in the literature. Several strategies could be applied to both formulations to improve their performance. Among them is the strategy proposed in Catanzaro et al. (2012). Generally the application of these strategies is not straightforward. We leave this approach for future work. Acknowledgments The research of Cristina Requejo and Olga Oliveira has been partially supported by Portuguese funds through the Center for Research and Development in Mathematics and Applications (CIDMA) and the FCT, the Portuguese Foundation for Science and Technology, within project UID/MAT/04106/2013. The research of Olga Oliveira has been supported by a research fellowship (grant SFRH/BD/76268/2011) through FCT, the Portuguese Foundation for Science and Technology, within the project POPH-QREN. The research of Bernard Fortz and Olga Oliveira has been funded by the Interuniversity Attraction Poles Programme P7/36 COMEX initiated by the Belgian Science Policy Office. References Abdi, Dress, von Haeseler, 1990 H. Abdi Additive-tree representations Dress A. von Haeseler A. Trees and Hierarchical Structures Lecture Notes in Biomathematics 84 1990 Springer Berlin Heidelberg 43 59 Bhamidi, Rajagopal, Roch, 2010 S. Bhamidi R. Rajagopal S. Roch Network delay inference from additive metrics Random Structures Algorithms 37 2 2010 176 203 Buneman, 1974 P. Buneman A note on the metric properties of trees Journal of Combinatorial Theory 17 1974 48 50 Byun, Yoo, 2006 S.-S. Byun C. Yoo Reducing delivery delay in HRM tree Gavrilova M. Gervasi O. Kumar V. Tan C. Taniar D. Lagan\u00e0 A. Mun Y. Choo H. Computational Science and Its Applications - ICCSA 2006 Lecture Notes in Computer Science 3981 2006 Springer Berlin Heidelberg 1189 1198 Catanzaro, 2009 D. Catanzaro The minimum evolution problem: overview and classification Networks 53 2 2009 112 125 Catanzaro, Aringhieri, Summa, Pesenti, 2015 D. Catanzaro R. Aringhieri M.D. Summa R. Pesenti A branch-price-and-cut algorithm for the minimum evolution problem European Journal of Operational Research 244 3 2015 753 765 Catanzaro, Labb\u00e9, Pesenti, Salazar-Gonzal\u00e9z, 2009 D. Catanzaro M. Labb\u00e9 R. Pesenti J.-J. Salazar-Gonzal\u00e9z Mathematical models to reconstruct phylogenetic trees under the minimum evolution criterion Networks 53 2 2009 126 140 Catanzaro, Labb\u00e9, Pesenti, Salazar-Gonzal\u00e9z, 2012 D. Catanzaro M. Labb\u00e9 R. Pesenti J.-J. Salazar-Gonzal\u00e9z The balanced minimum evolution problem INFORMS Journal on Computing 24 2 2012 276 294 Cavalli-Sforza, Edwards, 1967 L. Cavalli-Sforza A. Edwards Phylogenetic analysis. Models and estimation procedures American Journal of Human Genetics 19 1967 233 257 Chung, Garrett, Graham, Shallcross, 2001 F. Chung M. Garrett R. Graham D. Shallcross Distance realization problems with applications to internet tomography Journal of Computer and System Sciences 63 3 2001 432 448 Coates, Castro, Nowak, Gadhiok, King, Tsang, 2002 M. Coates R. Castro R. Nowak M. Gadhiok R. King Y. Tsang Maximum likelihood network topology identification from edge-based unicast measurements ACM SIGMETRICS performance evaluation review 30 2002 11 20 Coates, Rabbat, Nowak, 2003 M. Coates M. Rabbat R. Nowak Merging logical topologies using end-to-end measurements Proceedings of the 3rd ACM SIGCOMM conference on internet measurement, IMC \u201903 2003 192 203 Corter, Tversky, 1986 J.E. Corter A. Tversky Extended similarity trees Psychometrika 51 3 1986 429 451 Cunningham, 1980 J.P. Cunningham Trees as memory representations for simple visual patterns Memory & Cognition 8 6 1980 593 605 Day, 1987 W.H. Day Computational complexity of inferring phylogenies from dissimilarity matrices Bulletin of Mathematical Biology 49 4 1987 461 467 Dias, Rocha, Goldenstein, 2012 Z. Dias A. Rocha S. Goldenstein Image phylogeny by minimal spanning trees IEEE Transactions on Information Forensics and Security 7 2 2012 774 788 Donnet, 2013 B. Donnet Internet topology discovery Data Traffic Monitoring and Analysis: From Measurement, Classification, and Anomaly Detection to Quality of Experience Lecture Notes in Computer Science 7754 2013 Springer 44 81 Donnet, Friedman, 2007 B. Donnet T. Friedman Internet topology discovery: a survey IEEE Communications Surveys 9 4 2007 2 14 Donnet, Raoult, Friedman, Crovella, 2006 B. Donnet P. Raoult T. Friedman M. Crovella Deployment of an algorithm for large-scale topology discovery IEEE Journal on Selected Areas in Communications 24 12 2006 2210 2220 Dress, 1984 A. Dress Trees, tight extensions of metric spaces, and the cohomological dimension of certain groups: a note on combinatorial properties of metric spaces Advances in Mathematics 53 1984 321 402 Duffield, Horowitz, Presti, Towsley, 2002 N. Duffield J. Horowitz F.L. Presti D. Towsley Multicast topology inference from measured end-to-end loss IEEE Transactions on Information Theory 48 1 2002 26 45 Duffield, Horowitz, Prestis, 2001 N. Duffield J. Horowitz F.L. Prestis Adaptive multicast topology inference INFOCOM 2001. twentieth annual joint conference of the IEEE computer and communications societies. proceedings IEEE., volume 3 2001 1636 1645 Edelberg, Garey, Graham, 1976 M. Edelberg M. Garey R. Graham On the distance matrix of a tree Discrete Mathematics 14 1976 23 39 Eriksson, Dasarathy, Barford, Nowak, 2010 B. Eriksson G. Dasarathy P. Barford R. Nowak Toward the practical use of network tomography for internet topology discovery Proceedings of the INFOCOM 2010, the IEEE conference on computer communications 2010 1 9 Farach, Kannan, Warnow, 1995 M. Farach S. Kannan T. Warnow A robust model for finding optimal evolutionary trees Algorithmica 13 1 1995 155 179 Felsenstein, 2004 J. Felsenstein Distance matrix methods Inferring Phylogenies, chapter 11 2004 Sinauer Associates, Inc Sunderland, Massachusetts 147 175 Fiorini, Joret, 2012 S. Fiorini G. Joret Approximating the balanced minimum evolution problem Operations Research Letters 40 1 2012 31 35 Gaschen, Taylor, Yusim, Foley, Gao, Lang et al., 2002 B. Gaschen J. Taylor K. Yusim B. Foley F. Gao D. Lang Diversity considerations in HIV-1 vaccine selection Science 296 5577 2002 2354 2360 Gilmore, Hersh, Caramazza, Griffin, 1979 G. Gilmore H. Hersh A. Caramazza J. Griffin Multidimensional letter similarity derived from recognition errors Perception & Psychophysics 25 5 1979 425 431 Gouveia, 1995 L. Gouveia Using the Miller-Tucker-Zemlin constraints to formulate a minimal spanning tree problem with hop constraints Computers and Operations Research 22 9 1995 959 970 Gouveia, 1996 L. Gouveia Multicommodity flow models for spanning trees with hop constraints European Journal of Operational Research 95 1996 178 190 Govindan, Tangmunarunkit, 2000 R. Govindan H. Tangmunarunkit Heuristic for internet map discovery Proceeding of the 19th annual joint conference of IEEE computer and communications societies, volume 3 2000 1371 1380 Haddadi, Rio, Iannaccone, Moore, Mortier, 2008 H. Haddadi M. Rio G. Iannaccone A. Moore R. Mortier Network topologies: inference, modelling and generation IEEE Communications Surveys 10 2 2008 48 69 Hakimi, Patrinos, 1972\u201373 S.L. Hakimi A. Patrinos The distance matrix of a graph and its tree realization Quarterly of Applied Mathematics 30 1972 255 269 73 Hakimi, Yau, 1965 S.L. Hakimi S.S. Yau Distance matrix of a graph and its realizability Quarterly of Applied Mathematics 22 1965 305 317 Huson, Scornavacca, 2011 D. Huson C. Scornavacca A survey of combinatorial methods for phylogenetic networks Genome Biology and Evolution 3 2011 23 35 Isaev, 2006 A. Isaev Introduction to Mathematical Methods in Bioinformatics 2006 Springer Junker, Schreiber, 2008 B.H. Junker F. Schreiber Analysis of Biological Networks 2008 John Wiley & Sons Koolen, Moulton, 2009 A.L.J. Koolen V. Moulton Optimal realizations of generic five-point metric European Journal of Combinatorics 30 2009 1164 1171 Magnanti, Wolsey, 1995 T.L. Magnanti L.A. Wolsey Optimal trees Ball M. Magnanti T.L. Monma C. Nemhauser G.L. Network Models, Handbooks in Operations Research and Management Science, Vol. 7 1995 Elsevier Science Publishers North-Holland 503 615 Miller, Tucker, Zemlin, 1960 C. Miller A. Tucker R. Zemlin Integer programming formulations and travelling salesman problems Journal of the Association for Computing Machinery 7 4 1960 326 329 Mount, 2001 D. Mount Bioinformatics. Sequence and genome analysis 2001 Cold Spring Harbor Laboratory Press Nei, Kumar, 2000 M. Nei S. Kumar Molecular evolution and phylogenetics 2000 Oxford University Press Ni, Tatikonda, 2011 J. Ni S. Tatikonda Network tomography based on additive metrics IEEE Transactions on Information Theory 57 12 2011 7798 7809 Ni, Xie, Tatikonda, Yang, 2008 J. Ni H. Xie S. Tatikonda Y.R. Yang Network routing topology inference from end-to-end measurements INFOCOM 2008, the 27th IEEE conference on computer communications 2008 Network Simulator NS-3 Network Simulator NS-3. www.nsnam.org. Parker, Ram, 1996 D. Parker P. Ram The construction of Huffman codes is a submodular (\u201cconvex\u201d) optimization problem over a lattice of binary trees SIAM Journal on Computing 28 5 1996 1875 1905 Pauplin, 2000 Y. Pauplin Direct calculation of a tree length using a distance matrix Journal of Molecular Evolution 51 2000 41 47 Sattath, Tversky, 1977 S. Sattath A. Tversky Additive similarity trees Psichometrica 42 3 1977 319 345 Shih, Hero, 2007 M.-F. Shih A. Hero Hierarchical inference of unicast network topologies based on end-to-end measurements IEEE Transactions on Signal Processing 55 5 2007 1708 1718 Sim\u00f5es-Pereira, 1987 J. Sim\u00f5es-Pereira A note on distance matrices with unicyclic graph realizations Discrete Mathematics 65 1987 277 287 Sim\u00f5es-Pereira, 1990 J. Sim\u00f5es-Pereira An algorithm and its role in the study of optimal graph realizations of distance matrices Discrete Mathematics 79 1990 299 312 Sim\u00f5es-Pereira, Zamfirescu, 1982 J. Sim\u00f5es-Pereira C. Zamfirescu Submatrices of non-tree-realizable distance matrices Linear Algebra and its Applications 44 1982 1 17 Soete, 1983 G.D. Soete A least squares algorithm for fitting additive trees to proximity data Psychometrika 48 4 1983 621 626 FICO Xpress Optimization Suite FICO Xpress Optimization Suite. www.fico.com/xpress. Varone, 1998 S.C. Varone Trees related to realizations of distance matrices Discrete Mathematics 192 1998 337 346 Varone, 2006 S.C. Varone A constructive algorithm for realizing a distance matrix European Journal of Operational Research 174 1 2006 102 111", "scopus-id": "84990232272", "coredata": {"eid": "1-s2.0-S0377221716304349", "dc:description": "The Minimum Weighted Tree Reconstruction (MWTR) problem consists of finding a minimum length weighted tree connecting a set of terminal nodes in such a way that the length of the path between each pair of terminal nodes is greater than or equal to a given distance between the considered pair of terminal nodes. This problem has applications in several areas, namely, the inference of phylogenetic trees, the modeling of traffic networks and the analysis of internet infrastructures. In this paper, we investigate the MWTR problem and we present two compact mixed-integer linear programming models to solve the problem. Computational results using two different sets of instances, one from the phylogenetic area and another from the telecommunications area, show that the best of the two models is able to solve instances of the problem having up to 15 terminal nodes.", "openArchiveArticle": "false", "prism:coverDate": "2017-01-01", "openaccessUserLicense": null, "prism:aggregationType": "Journal", "prism:url": "https://api.elsevier.com/content/article/pii/S0377221716304349", "dc:creator": [{"@_fa": "true", "$": "Fortz, Bernard"}, {"@_fa": "true", "$": "Oliveira, Olga"}, {"@_fa": "true", "$": "Requejo, Cristina"}], "link": [{"@_fa": "true", "@rel": "self", "@href": "https://api.elsevier.com/content/article/pii/S0377221716304349"}, {"@_fa": "true", "@rel": "scidir", "@href": "https://www.sciencedirect.com/science/article/pii/S0377221716304349"}], "dc:format": "application/json", "openaccessType": null, "pii": "S0377-2217(16)30434-9", "prism:volume": "256", "prism:publisher": "Elsevier B.V.", "dc:title": "Compact mixed integer linear programming models to the minimum weighted tree reconstruction problem", "prism:copyright": "\u00a9 2016 Elsevier B.V. All rights reserved.", "openaccess": "0", "prism:issn": "03772217", "prism:issueIdentifier": "1", "dcterms:subject": [{"@_fa": "true", "$": "Mixed integer linear programming"}, {"@_fa": "true", "$": "Tree realization"}, {"@_fa": "true", "$": "Topology discovery"}, {"@_fa": "true", "$": "Routing topology inference"}, {"@_fa": "true", "$": "Minimum evolution problem"}], "openaccessArticle": "false", "prism:publicationName": "European Journal of Operational Research", "prism:number": "1", "openaccessSponsorType": null, "prism:pageRange": "242-251", "prism:endingPage": "251", "pubType": "fla", "prism:coverDisplayDate": "1 January 2017", "prism:doi": "10.1016/j.ejor.2016.06.014", "prism:startingPage": "242", "dc:identifier": "doi:10.1016/j.ejor.2016.06.014", "openaccessSponsorName": null}, "objects": {"object": [{"@category": "thumbnail", "@height": "86", "@width": "219", "@_fa": "true", "$": "https://api.elsevier.com/content/object/eid/1-s2.0-S0377221716304349-gr1.sml?httpAccept=%2A%2F%2A", "@multimediatype": "GIF image file", "@type": "IMAGE-THUMBNAIL", "@size": "5431", "@ref": "gr1", "@mimetype": "image/gif"}, {"@category": "thumbnail", "@height": "100", "@width": "219", "@_fa": "true", "$": "https://api.elsevier.com/content/object/eid/1-s2.0-S0377221716304349-gr2.sml?httpAccept=%2A%2F%2A", "@multimediatype": "GIF image file", "@type": "IMAGE-THUMBNAIL", "@size": "7033", "@ref": "gr2", "@mimetype": "image/gif"}, {"@category": "thumbnail", "@height": "44", "@width": "219", "@_fa": "true", "$": "https://api.elsevier.com/content/object/eid/1-s2.0-S0377221716304349-gr3.sml?httpAccept=%2A%2F%2A", "@multimediatype": "GIF image file", "@type": "IMAGE-THUMBNAIL", "@size": "5275", "@ref": "gr3", "@mimetype": "image/gif"}, {"@category": "thumbnail", "@height": "38", "@width": "219", "@_fa": "true", "$": "https://api.elsevier.com/content/object/eid/1-s2.0-S0377221716304349-gr4.sml?httpAccept=%2A%2F%2A", "@multimediatype": "GIF image file", "@type": "IMAGE-THUMBNAIL", "@size": "4952", "@ref": "gr4", "@mimetype": "image/gif"}, {"@category": "thumbnail", "@height": "126", "@width": "219", "@_fa": "true", "$": "https://api.elsevier.com/content/object/eid/1-s2.0-S0377221716304349-gr5.sml?httpAccept=%2A%2F%2A", "@multimediatype": "GIF image file", "@type": "IMAGE-THUMBNAIL", "@size": "9380", "@ref": "gr5", "@mimetype": "image/gif"}, {"@category": "standard", "@height": "180", "@width": "461", "@_fa": "true", "$": "https://api.elsevier.com/content/object/eid/1-s2.0-S0377221716304349-gr1.jpg?httpAccept=%2A%2F%2A", "@multimediatype": "JPEG image file", "@type": "IMAGE-DOWNSAMPLED", "@size": "15354", "@ref": "gr1", "@mimetype": "image/jpeg"}, {"@category": "standard", "@height": "73", "@width": "160", "@_fa": "true", "$": "https://api.elsevier.com/content/object/eid/1-s2.0-S0377221716304349-gr2.jpg?httpAccept=%2A%2F%2A", "@multimediatype": "JPEG image file", "@type": "IMAGE-DOWNSAMPLED", "@size": "7106", "@ref": "gr2", "@mimetype": "image/jpeg"}, {"@category": "standard", "@height": "69", "@width": "342", "@_fa": "true", "$": "https://api.elsevier.com/content/object/eid/1-s2.0-S0377221716304349-gr3.jpg?httpAccept=%2A%2F%2A", "@multimediatype": "JPEG image file", "@type": "IMAGE-DOWNSAMPLED", "@size": "11713", "@ref": "gr3", "@mimetype": "image/jpeg"}, {"@category": "standard", "@height": "113", "@width": "658", "@_fa": "true", "$": "https://api.elsevier.com/content/object/eid/1-s2.0-S0377221716304349-gr4.jpg?httpAccept=%2A%2F%2A", "@multimediatype": "JPEG image file", "@type": "IMAGE-DOWNSAMPLED", "@size": "21587", "@ref": "gr4", "@mimetype": "image/jpeg"}, {"@category": "standard", "@height": "221", "@width": "384", "@_fa": "true", "$": "https://api.elsevier.com/content/object/eid/1-s2.0-S0377221716304349-gr5.jpg?httpAccept=%2A%2F%2A", "@multimediatype": "JPEG image file", "@type": "IMAGE-DOWNSAMPLED", "@size": "22255", "@ref": "gr5", "@mimetype": "image/jpeg"}, {"@category": "thumbnail", "@height": "24", "@width": "22", "@_fa": "true", "$": "https://api.elsevier.com/content/object/eid/1-s2.0-S0377221716304349-si10.gif?httpAccept=%2A%2F%2A", "@multimediatype": "GIF image file", "@type": "ALTIMG", "@size": "253", "@ref": "si10", "@mimetype": "image/gif"}, {"@category": "thumbnail", "@height": "13", "@width": "52", "@_fa": "true", "$": "https://api.elsevier.com/content/object/eid/1-s2.0-S0377221716304349-si20.gif?httpAccept=%2A%2F%2A", "@multimediatype": "GIF image file", "@type": "ALTIMG", "@size": "258", "@ref": "si20", "@mimetype": "image/gif"}, {"@category": "thumbnail", "@height": "16", "@width": "68", "@_fa": "true", "$": "https://api.elsevier.com/content/object/eid/1-s2.0-S0377221716304349-si30.gif?httpAccept=%2A%2F%2A", "@multimediatype": "GIF image file", "@type": "ALTIMG", "@size": "279", "@ref": "si30", "@mimetype": "image/gif"}, {"@category": "thumbnail", "@height": "51", "@width": "165", "@_fa": "true", "$": "https://api.elsevier.com/content/object/eid/1-s2.0-S0377221716304349-si40.gif?httpAccept=%2A%2F%2A", "@multimediatype": "GIF image file", "@type": "ALTIMG", "@size": "755", "@ref": "si40", "@mimetype": "image/gif"}, {"@category": "thumbnail", "@height": "19", "@width": "516", "@_fa": "true", "$": "https://api.elsevier.com/content/object/eid/1-s2.0-S0377221716304349-si50.gif?httpAccept=%2A%2F%2A", "@multimediatype": "GIF image file", "@type": "ALTIMG", "@size": "1578", "@ref": "si50", "@mimetype": "image/gif"}, {"@category": "thumbnail", "@height": "22", "@width": "118", "@_fa": "true", "$": "https://api.elsevier.com/content/object/eid/1-s2.0-S0377221716304349-si60.gif?httpAccept=%2A%2F%2A", "@multimediatype": "GIF image file", "@type": "ALTIMG", "@size": "540", "@ref": "si60", "@mimetype": "image/gif"}, {"@category": "thumbnail", "@height": "25", "@width": "21", "@_fa": "true", "$": "https://api.elsevier.com/content/object/eid/1-s2.0-S0377221716304349-si70.gif?httpAccept=%2A%2F%2A", "@multimediatype": "GIF image file", "@type": "ALTIMG", "@size": "214", "@ref": "si70", "@mimetype": "image/gif"}, {"@category": "thumbnail", "@height": "43", "@width": "248", "@_fa": "true", "$": "https://api.elsevier.com/content/object/eid/1-s2.0-S0377221716304349-si80.gif?httpAccept=%2A%2F%2A", "@multimediatype": "GIF image file", "@type": "ALTIMG", "@size": "1055", "@ref": "si80", "@mimetype": "image/gif"}, {"@category": "thumbnail", "@height": "16", "@width": "142", "@_fa": "true", "$": "https://api.elsevier.com/content/object/eid/1-s2.0-S0377221716304349-si90.gif?httpAccept=%2A%2F%2A", "@multimediatype": "GIF image file", "@type": "ALTIMG", "@size": "505", "@ref": "si90", "@mimetype": "image/gif"}, {"@category": "thumbnail", "@height": "16", "@width": "154", "@_fa": "true", "$": "https://api.elsevier.com/content/object/eid/1-s2.0-S0377221716304349-si100.gif?httpAccept=%2A%2F%2A", "@multimediatype": "GIF image file", "@type": "ALTIMG", "@size": "453", "@ref": "si100", "@mimetype": "image/gif"}, {"@category": "thumbnail", "@height": "24", "@width": "118", "@_fa": "true", "$": "https://api.elsevier.com/content/object/eid/1-s2.0-S0377221716304349-si110.gif?httpAccept=%2A%2F%2A", "@multimediatype": "GIF image file", "@type": "ALTIMG", "@size": "514", "@ref": "si110", "@mimetype": "image/gif"}, {"@category": "thumbnail", "@height": "19", "@width": "421", "@_fa": "true", "$": "https://api.elsevier.com/content/object/eid/1-s2.0-S0377221716304349-si13.gif?httpAccept=%2A%2F%2A", "@multimediatype": "GIF image file", "@type": "ALTIMG", "@size": "1586", "@ref": "si13", "@mimetype": "image/gif"}, {"@category": "thumbnail", "@height": "18", "@width": "72", "@_fa": "true", "$": "https://api.elsevier.com/content/object/eid/1-s2.0-S0377221716304349-si14.gif?httpAccept=%2A%2F%2A", "@multimediatype": "GIF image file", "@type": "ALTIMG", "@size": "389", "@ref": "si14", "@mimetype": "image/gif"}, {"@category": "thumbnail", "@height": "18", "@width": "67", "@_fa": "true", "$": "https://api.elsevier.com/content/object/eid/1-s2.0-S0377221716304349-si15.gif?httpAccept=%2A%2F%2A", "@multimediatype": "GIF image file", "@type": "ALTIMG", "@size": "370", "@ref": "si15", "@mimetype": "image/gif"}, {"@category": "thumbnail", "@height": "18", "@width": "72", "@_fa": "true", "$": "https://api.elsevier.com/content/object/eid/1-s2.0-S0377221716304349-si16.gif?httpAccept=%2A%2F%2A", "@multimediatype": "GIF image file", "@type": "ALTIMG", "@size": "387", "@ref": "si16", "@mimetype": "image/gif"}, {"@category": "thumbnail", "@height": "48", "@width": "464", "@_fa": "true", "$": "https://api.elsevier.com/content/object/eid/1-s2.0-S0377221716304349-si17.gif?httpAccept=%2A%2F%2A", "@multimediatype": "GIF image file", "@type": "ALTIMG", "@size": "2226", "@ref": "si17", "@mimetype": "image/gif"}, {"@category": "thumbnail", "@height": "14", "@width": "92", "@_fa": "true", "$": "https://api.elsevier.com/content/object/eid/1-s2.0-S0377221716304349-si18.gif?httpAccept=%2A%2F%2A", "@multimediatype": "GIF image file", "@type": "ALTIMG", "@size": "376", "@ref": "si18", "@mimetype": "image/gif"}, {"@category": "thumbnail", "@height": "15", "@width": "64", "@_fa": "true", "$": "https://api.elsevier.com/content/object/eid/1-s2.0-S0377221716304349-si19.gif?httpAccept=%2A%2F%2A", "@multimediatype": "GIF image file", "@type": "ALTIMG", "@size": "284", "@ref": "si19", "@mimetype": "image/gif"}, {"@category": "thumbnail", "@height": "16", "@width": "88", "@_fa": "true", "$": "https://api.elsevier.com/content/object/eid/1-s2.0-S0377221716304349-si2.gif?httpAccept=%2A%2F%2A", "@multimediatype": "GIF image file", "@type": "ALTIMG", "@size": "387", "@ref": "si2", "@mimetype": "image/gif"}, {"@category": "thumbnail", "@height": "16", "@width": "153", "@_fa": "true", "$": "https://api.elsevier.com/content/object/eid/1-s2.0-S0377221716304349-si21.gif?httpAccept=%2A%2F%2A", "@multimediatype": "GIF image file", "@type": "ALTIMG", "@size": "472", "@ref": "si21", "@mimetype": "image/gif"}, {"@category": "thumbnail", "@height": "16", "@width": "194", "@_fa": "true", "$": "https://api.elsevier.com/content/object/eid/1-s2.0-S0377221716304349-si22.gif?httpAccept=%2A%2F%2A", "@multimediatype": "GIF image file", "@type": "ALTIMG", "@size": "569", "@ref": "si22", "@mimetype": "image/gif"}, {"@category": "thumbnail", "@height": "21", "@width": "23", "@_fa": "true", "$": "https://api.elsevier.com/content/object/eid/1-s2.0-S0377221716304349-si23.gif?httpAccept=%2A%2F%2A", "@multimediatype": "GIF image file", "@type": "ALTIMG", "@size": "201", "@ref": "si23", "@mimetype": "image/gif"}, {"@category": "thumbnail", "@height": "13", "@width": "43", "@_fa": "true", "$": "https://api.elsevier.com/content/object/eid/1-s2.0-S0377221716304349-si24.gif?httpAccept=%2A%2F%2A", "@multimediatype": "GIF image file", "@type": "ALTIMG", "@size": "183", "@ref": "si24", "@mimetype": "image/gif"}, {"@category": "thumbnail", "@height": "21", "@width": "23", "@_fa": "true", "$": "https://api.elsevier.com/content/object/eid/1-s2.0-S0377221716304349-si25.gif?httpAccept=%2A%2F%2A", "@multimediatype": "GIF image file", "@type": "ALTIMG", "@size": "199", "@ref": "si25", "@mimetype": "image/gif"}, {"@category": "thumbnail", "@height": "21", "@width": "93", "@_fa": "true", "$": "https://api.elsevier.com/content/object/eid/1-s2.0-S0377221716304349-si26.gif?httpAccept=%2A%2F%2A", "@multimediatype": "GIF image file", "@type": "ALTIMG", "@size": "349", "@ref": "si26", "@mimetype": "image/gif"}, {"@category": "thumbnail", "@height": "21", "@width": "292", "@_fa": "true", "$": "https://api.elsevier.com/content/object/eid/1-s2.0-S0377221716304349-si27.gif?httpAccept=%2A%2F%2A", "@multimediatype": "GIF image file", "@type": "ALTIMG", "@size": "861", "@ref": "si27", "@mimetype": "image/gif"}, {"@category": "thumbnail", "@height": "21", "@width": "79", "@_fa": "true", "$": "https://api.elsevier.com/content/object/eid/1-s2.0-S0377221716304349-si28.gif?httpAccept=%2A%2F%2A", "@multimediatype": "GIF image file", "@type": "ALTIMG", "@size": "293", "@ref": "si28", "@mimetype": "image/gif"}, {"@category": "thumbnail", "@height": "21", "@width": "46", "@_fa": "true", "$": "https://api.elsevier.com/content/object/eid/1-s2.0-S0377221716304349-si29.gif?httpAccept=%2A%2F%2A", "@multimediatype": "GIF image file", "@type": "ALTIMG", "@size": "227", "@ref": "si29", "@mimetype": "image/gif"}, {"@category": "thumbnail", "@height": "15", "@width": "98", "@_fa": "true", "$": "https://api.elsevier.com/content/object/eid/1-s2.0-S0377221716304349-si3.gif?httpAccept=%2A%2F%2A", "@multimediatype": "GIF image file", "@type": "ALTIMG", "@size": "389", "@ref": "si3", "@mimetype": "image/gif"}, {"@category": "thumbnail", "@height": "21", "@width": "150", "@_fa": "true", "$": "https://api.elsevier.com/content/object/eid/1-s2.0-S0377221716304349-si31.gif?httpAccept=%2A%2F%2A", "@multimediatype": "GIF image file", "@type": "ALTIMG", "@size": "418", "@ref": "si31", "@mimetype": "image/gif"}, {"@category": "thumbnail", "@height": "45", "@width": "97", "@_fa": "true", "$": "https://api.elsevier.com/content/object/eid/1-s2.0-S0377221716304349-si32.gif?httpAccept=%2A%2F%2A", "@multimediatype": "GIF image file", "@type": "ALTIMG", "@size": "596", "@ref": "si32", "@mimetype": "image/gif"}, {"@category": "thumbnail", "@height": "16", "@width": "119", "@_fa": "true", "$": "https://api.elsevier.com/content/object/eid/1-s2.0-S0377221716304349-si33.gif?httpAccept=%2A%2F%2A", "@multimediatype": "GIF image file", "@type": "ALTIMG", "@size": "424", "@ref": "si33", "@mimetype": "image/gif"}, {"@category": "thumbnail", "@height": "44", "@width": "351", "@_fa": "true", "$": "https://api.elsevier.com/content/object/eid/1-s2.0-S0377221716304349-si34.gif?httpAccept=%2A%2F%2A", "@multimediatype": "GIF image file", "@type": "ALTIMG", "@size": "1240", "@ref": "si34", "@mimetype": "image/gif"}, {"@category": "thumbnail", "@height": "44", "@width": "317", "@_fa": "true", "$": "https://api.elsevier.com/content/object/eid/1-s2.0-S0377221716304349-si35.gif?httpAccept=%2A%2F%2A", "@multimediatype": "GIF image file", "@type": "ALTIMG", "@size": "1208", "@ref": "si35", "@mimetype": "image/gif"}, {"@category": "thumbnail", "@height": "25", "@width": "21", "@_fa": "true", "$": "https://api.elsevier.com/content/object/eid/1-s2.0-S0377221716304349-si36.gif?httpAccept=%2A%2F%2A", "@multimediatype": "GIF image file", "@type": "ALTIMG", "@size": "223", "@ref": "si36", "@mimetype": "image/gif"}, {"@category": "thumbnail", "@height": "50", "@width": "132", "@_fa": "true", "$": "https://api.elsevier.com/content/object/eid/1-s2.0-S0377221716304349-si37.gif?httpAccept=%2A%2F%2A", "@multimediatype": "GIF image file", "@type": "ALTIMG", "@size": "804", "@ref": "si37", "@mimetype": "image/gif"}, {"@category": "thumbnail", "@height": "50", "@width": "157", "@_fa": "true", "$": "https://api.elsevier.com/content/object/eid/1-s2.0-S0377221716304349-si38.gif?httpAccept=%2A%2F%2A", "@multimediatype": "GIF image file", "@type": "ALTIMG", "@size": "825", "@ref": "si38", "@mimetype": "image/gif"}, {"@category": "thumbnail", "@height": "51", "@width": "237", "@_fa": "true", "$": "https://api.elsevier.com/content/object/eid/1-s2.0-S0377221716304349-si39.gif?httpAccept=%2A%2F%2A", "@multimediatype": "GIF image file", "@type": "ALTIMG", "@size": "1079", "@ref": "si39", "@mimetype": "image/gif"}, {"@category": "thumbnail", "@height": "13", "@width": "45", "@_fa": "true", "$": "https://api.elsevier.com/content/object/eid/1-s2.0-S0377221716304349-si4.gif?httpAccept=%2A%2F%2A", "@multimediatype": "GIF image file", "@type": "ALTIMG", "@size": "206", "@ref": "si4", "@mimetype": "image/gif"}, {"@category": "thumbnail", "@height": "18", "@width": "342", "@_fa": "true", "$": "https://api.elsevier.com/content/object/eid/1-s2.0-S0377221716304349-si41.gif?httpAccept=%2A%2F%2A", "@multimediatype": "GIF image file", "@type": "ALTIMG", "@size": "940", "@ref": "si41", "@mimetype": "image/gif"}, {"@category": "thumbnail", "@height": "51", "@width": "184", "@_fa": "true", "$": "https://api.elsevier.com/content/object/eid/1-s2.0-S0377221716304349-si42.gif?httpAccept=%2A%2F%2A", "@multimediatype": "GIF image file", "@type": "ALTIMG", "@size": "960", "@ref": "si42", "@mimetype": "image/gif"}, {"@category": "thumbnail", "@height": "43", "@width": "166", "@_fa": "true", "$": "https://api.elsevier.com/content/object/eid/1-s2.0-S0377221716304349-si43.gif?httpAccept=%2A%2F%2A", "@multimediatype": "GIF image file", "@type": "ALTIMG", "@size": "794", "@ref": "si43", "@mimetype": "image/gif"}, {"@category": "thumbnail", "@height": "51", "@width": "346", "@_fa": "true", "$": "https://api.elsevier.com/content/object/eid/1-s2.0-S0377221716304349-si44.gif?httpAccept=%2A%2F%2A", "@multimediatype": "GIF image file", "@type": "ALTIMG", "@size": "1604", "@ref": "si44", "@mimetype": "image/gif"}, {"@category": "thumbnail", "@height": "24", "@width": "412", "@_fa": "true", "$": "https://api.elsevier.com/content/object/eid/1-s2.0-S0377221716304349-si45.gif?httpAccept=%2A%2F%2A", "@multimediatype": "GIF image file", "@type": "ALTIMG", "@size": "1338", "@ref": "si45", "@mimetype": "image/gif"}, {"@category": "thumbnail", "@height": "19", "@width": "217", "@_fa": "true", "$": "https://api.elsevier.com/content/object/eid/1-s2.0-S0377221716304349-si46.gif?httpAccept=%2A%2F%2A", "@multimediatype": "GIF image file", "@type": "ALTIMG", "@size": "753", "@ref": "si46", "@mimetype": "image/gif"}, {"@category": "thumbnail", "@height": "18", "@width": "285", "@_fa": "true", "$": "https://api.elsevier.com/content/object/eid/1-s2.0-S0377221716304349-si47.gif?httpAccept=%2A%2F%2A", "@multimediatype": "GIF image file", "@type": "ALTIMG", "@size": "905", "@ref": "si47", "@mimetype": "image/gif"}, {"@category": "thumbnail", "@height": "19", "@width": "314", "@_fa": "true", "$": "https://api.elsevier.com/content/object/eid/1-s2.0-S0377221716304349-si48.gif?httpAccept=%2A%2F%2A", "@multimediatype": "GIF image file", "@type": "ALTIMG", "@size": "1041", "@ref": "si48", "@mimetype": "image/gif"}, {"@category": "thumbnail", "@height": "19", "@width": "406", "@_fa": "true", "$": "https://api.elsevier.com/content/object/eid/1-s2.0-S0377221716304349-si49.gif?httpAccept=%2A%2F%2A", "@multimediatype": "GIF image file", "@type": "ALTIMG", "@size": "1257", "@ref": "si49", "@mimetype": "image/gif"}, {"@category": "thumbnail", "@height": "24", "@width": "123", "@_fa": "true", "$": "https://api.elsevier.com/content/object/eid/1-s2.0-S0377221716304349-si5.gif?httpAccept=%2A%2F%2A", "@multimediatype": "GIF image file", "@type": "ALTIMG", "@size": "559", "@ref": "si5", "@mimetype": "image/gif"}, {"@category": "thumbnail", "@height": "19", "@width": "516", "@_fa": "true", "$": "https://api.elsevier.com/content/object/eid/1-s2.0-S0377221716304349-si51.gif?httpAccept=%2A%2F%2A", "@multimediatype": "GIF image file", "@type": "ALTIMG", "@size": "1588", "@ref": "si51", "@mimetype": "image/gif"}, {"@category": "thumbnail", "@height": "19", "@width": "517", "@_fa": "true", "$": "https://api.elsevier.com/content/object/eid/1-s2.0-S0377221716304349-si52.gif?httpAccept=%2A%2F%2A", "@multimediatype": "GIF image file", "@type": "ALTIMG", "@size": "1595", "@ref": "si52", "@mimetype": "image/gif"}, {"@category": "thumbnail", "@height": "19", "@width": "517", "@_fa": "true", "$": "https://api.elsevier.com/content/object/eid/1-s2.0-S0377221716304349-si53.gif?httpAccept=%2A%2F%2A", "@multimediatype": "GIF image file", "@type": "ALTIMG", "@size": "1591", "@ref": "si53", "@mimetype": "image/gif"}, {"@category": "thumbnail", "@height": "19", "@width": "514", "@_fa": "true", "$": "https://api.elsevier.com/content/object/eid/1-s2.0-S0377221716304349-si54.gif?httpAccept=%2A%2F%2A", "@multimediatype": "GIF image file", "@type": "ALTIMG", "@size": "1542", "@ref": "si54", "@mimetype": "image/gif"}, {"@category": "thumbnail", "@height": "19", "@width": "514", "@_fa": "true", "$": "https://api.elsevier.com/content/object/eid/1-s2.0-S0377221716304349-si55.gif?httpAccept=%2A%2F%2A", "@multimediatype": "GIF image file", "@type": "ALTIMG", "@size": "1552", "@ref": "si55", "@mimetype": "image/gif"}, {"@category": "thumbnail", "@height": "19", "@width": "294", "@_fa": "true", "$": "https://api.elsevier.com/content/object/eid/1-s2.0-S0377221716304349-si56.gif?httpAccept=%2A%2F%2A", "@multimediatype": "GIF image file", "@type": "ALTIMG", "@size": "971", "@ref": "si56", "@mimetype": "image/gif"}, {"@category": "thumbnail", "@height": "24", "@width": "379", "@_fa": "true", "$": "https://api.elsevier.com/content/object/eid/1-s2.0-S0377221716304349-si57.gif?httpAccept=%2A%2F%2A", "@multimediatype": "GIF image file", "@type": "ALTIMG", "@size": "1240", "@ref": "si57", "@mimetype": "image/gif"}, {"@category": "thumbnail", "@height": "19", "@width": "267", "@_fa": "true", "$": "https://api.elsevier.com/content/object/eid/1-s2.0-S0377221716304349-si58.gif?httpAccept=%2A%2F%2A", "@multimediatype": "GIF image file", "@type": "ALTIMG", "@size": "866", "@ref": "si58", "@mimetype": "image/gif"}, {"@category": "thumbnail", "@height": "19", "@width": "213", "@_fa": "true", "$": "https://api.elsevier.com/content/object/eid/1-s2.0-S0377221716304349-si59.gif?httpAccept=%2A%2F%2A", "@multimediatype": "GIF image file", "@type": "ALTIMG", "@size": "689", "@ref": "si59", "@mimetype": "image/gif"}, {"@category": "thumbnail", "@height": "18", "@width": "225", "@_fa": "true", "$": "https://api.elsevier.com/content/object/eid/1-s2.0-S0377221716304349-si6.gif?httpAccept=%2A%2F%2A", "@multimediatype": "GIF image file", "@type": "ALTIMG", "@size": "874", "@ref": "si6", "@mimetype": "image/gif"}, {"@category": "thumbnail", "@height": "24", "@width": "124", "@_fa": "true", "$": "https://api.elsevier.com/content/object/eid/1-s2.0-S0377221716304349-si61.gif?httpAccept=%2A%2F%2A", "@multimediatype": "GIF image file", "@type": "ALTIMG", "@size": "531", "@ref": "si61", "@mimetype": "image/gif"}, {"@category": "thumbnail", "@height": "23", "@width": "316", "@_fa": "true", "$": "https://api.elsevier.com/content/object/eid/1-s2.0-S0377221716304349-si62.gif?httpAccept=%2A%2F%2A", "@multimediatype": "GIF image file", "@type": "ALTIMG", "@size": "1123", "@ref": "si62", "@mimetype": "image/gif"}, {"@category": "thumbnail", "@height": "22", "@width": "212", "@_fa": "true", "$": "https://api.elsevier.com/content/object/eid/1-s2.0-S0377221716304349-si63.gif?httpAccept=%2A%2F%2A", "@multimediatype": "GIF image file", "@type": "ALTIMG", "@size": "816", "@ref": "si63", "@mimetype": "image/gif"}, {"@category": "thumbnail", "@height": "22", "@width": "211", "@_fa": "true", "$": "https://api.elsevier.com/content/object/eid/1-s2.0-S0377221716304349-si64.gif?httpAccept=%2A%2F%2A", "@multimediatype": "GIF image file", "@type": "ALTIMG", "@size": "836", "@ref": "si64", "@mimetype": "image/gif"}, {"@category": "thumbnail", "@height": "22", "@width": "279", "@_fa": "true", "$": "https://api.elsevier.com/content/object/eid/1-s2.0-S0377221716304349-si65.gif?httpAccept=%2A%2F%2A", "@multimediatype": "GIF image file", "@type": "ALTIMG", "@size": "1123", "@ref": "si65", "@mimetype": "image/gif"}, {"@category": "thumbnail", "@height": "25", "@width": "28", "@_fa": "true", "$": "https://api.elsevier.com/content/object/eid/1-s2.0-S0377221716304349-si66.gif?httpAccept=%2A%2F%2A", "@multimediatype": "GIF image file", "@type": "ALTIMG", "@size": "251", "@ref": "si66", "@mimetype": "image/gif"}, {"@category": "thumbnail", "@height": "16", "@width": "179", "@_fa": "true", "$": "https://api.elsevier.com/content/object/eid/1-s2.0-S0377221716304349-si67.gif?httpAccept=%2A%2F%2A", "@multimediatype": "GIF image file", "@type": "ALTIMG", "@size": "588", "@ref": "si67", "@mimetype": "image/gif"}, {"@category": "thumbnail", "@height": "25", "@width": "23", "@_fa": "true", "$": "https://api.elsevier.com/content/object/eid/1-s2.0-S0377221716304349-si68.gif?httpAccept=%2A%2F%2A", "@multimediatype": "GIF image file", "@type": "ALTIMG", "@size": "237", "@ref": "si68", "@mimetype": "image/gif"}, {"@category": "thumbnail", "@height": "27", "@width": "330", "@_fa": "true", "$": "https://api.elsevier.com/content/object/eid/1-s2.0-S0377221716304349-si69.gif?httpAccept=%2A%2F%2A", "@multimediatype": "GIF image file", "@type": "ALTIMG", "@size": "1310", "@ref": "si69", "@mimetype": "image/gif"}, {"@category": "thumbnail", "@height": "16", "@width": "88", "@_fa": "true", "$": "https://api.elsevier.com/content/object/eid/1-s2.0-S0377221716304349-si7.gif?httpAccept=%2A%2F%2A", "@multimediatype": "GIF image file", "@type": "ALTIMG", "@size": "400", "@ref": "si7", "@mimetype": "image/gif"}, {"@category": "thumbnail", "@height": "25", "@width": "31", "@_fa": "true", "$": "https://api.elsevier.com/content/object/eid/1-s2.0-S0377221716304349-si71.gif?httpAccept=%2A%2F%2A", "@multimediatype": "GIF image file", "@type": "ALTIMG", "@size": "280", "@ref": "si71", "@mimetype": "image/gif"}, {"@category": "thumbnail", "@height": "65", "@width": "225", "@_fa": "true", "$": "https://api.elsevier.com/content/object/eid/1-s2.0-S0377221716304349-si72.gif?httpAccept=%2A%2F%2A", "@multimediatype": "GIF image file", "@type": "ALTIMG", "@size": "1308", "@ref": "si72", "@mimetype": "image/gif"}, {"@category": "thumbnail", "@height": "51", "@width": "157", "@_fa": "true", "$": "https://api.elsevier.com/content/object/eid/1-s2.0-S0377221716304349-si73.gif?httpAccept=%2A%2F%2A", "@multimediatype": "GIF image file", "@type": "ALTIMG", "@size": "826", "@ref": "si73", "@mimetype": "image/gif"}, {"@category": "thumbnail", "@height": "43", "@width": "159", "@_fa": "true", "$": "https://api.elsevier.com/content/object/eid/1-s2.0-S0377221716304349-si74.gif?httpAccept=%2A%2F%2A", "@multimediatype": "GIF image file", "@type": "ALTIMG", "@size": "728", "@ref": "si74", "@mimetype": "image/gif"}, {"@category": "thumbnail", "@height": "51", "@width": "231", "@_fa": "true", "$": "https://api.elsevier.com/content/object/eid/1-s2.0-S0377221716304349-si75.gif?httpAccept=%2A%2F%2A", "@multimediatype": "GIF image file", "@type": "ALTIMG", "@size": "1082", "@ref": "si75", "@mimetype": "image/gif"}, {"@category": "thumbnail", "@height": "18", "@width": "334", "@_fa": "true", "$": "https://api.elsevier.com/content/object/eid/1-s2.0-S0377221716304349-si76.gif?httpAccept=%2A%2F%2A", "@multimediatype": "GIF image file", "@type": "ALTIMG", "@size": "934", "@ref": "si76", "@mimetype": "image/gif"}, {"@category": "thumbnail", "@height": "44", "@width": "88", "@_fa": "true", "$": "https://api.elsevier.com/content/object/eid/1-s2.0-S0377221716304349-si77.gif?httpAccept=%2A%2F%2A", "@multimediatype": "GIF image file", "@type": "ALTIMG", "@size": "497", "@ref": "si77", "@mimetype": "image/gif"}, {"@category": "thumbnail", "@height": "44", "@width": "116", "@_fa": "true", "$": "https://api.elsevier.com/content/object/eid/1-s2.0-S0377221716304349-si78.gif?httpAccept=%2A%2F%2A", "@multimediatype": "GIF image file", "@type": "ALTIMG", "@size": "605", "@ref": "si78", "@mimetype": "image/gif"}, {"@category": "thumbnail", "@height": "44", "@width": "151", "@_fa": "true", "$": "https://api.elsevier.com/content/object/eid/1-s2.0-S0377221716304349-si79.gif?httpAccept=%2A%2F%2A", "@multimediatype": "GIF image file", "@type": "ALTIMG", "@size": "771", "@ref": "si79", "@mimetype": "image/gif"}, {"@category": "thumbnail", "@height": "15", "@width": "60", "@_fa": "true", "$": "https://api.elsevier.com/content/object/eid/1-s2.0-S0377221716304349-si8.gif?httpAccept=%2A%2F%2A", "@multimediatype": "GIF image file", "@type": "ALTIMG", "@size": "271", "@ref": "si8", "@mimetype": "image/gif"}, {"@category": "thumbnail", "@height": "44", "@width": "488", "@_fa": "true", "$": "https://api.elsevier.com/content/object/eid/1-s2.0-S0377221716304349-si81.gif?httpAccept=%2A%2F%2A", "@multimediatype": "GIF image file", "@type": "ALTIMG", "@size": "1973", "@ref": "si81", "@mimetype": "image/gif"}, {"@category": "thumbnail", "@height": "43", "@width": "248", "@_fa": "true", "$": "https://api.elsevier.com/content/object/eid/1-s2.0-S0377221716304349-si82.gif?httpAccept=%2A%2F%2A", "@multimediatype": "GIF image file", "@type": "ALTIMG", "@size": "1059", "@ref": "si82", "@mimetype": "image/gif"}, {"@category": "thumbnail", "@height": "43", "@width": "529", "@_fa": "true", "$": "https://api.elsevier.com/content/object/eid/1-s2.0-S0377221716304349-si83.gif?httpAccept=%2A%2F%2A", "@multimediatype": "GIF image file", "@type": "ALTIMG", "@size": "2052", "@ref": "si83", "@mimetype": "image/gif"}, {"@category": "thumbnail", "@height": "24", "@width": "432", "@_fa": "true", "$": "https://api.elsevier.com/content/object/eid/1-s2.0-S0377221716304349-si84.gif?httpAccept=%2A%2F%2A", "@multimediatype": "GIF image file", "@type": "ALTIMG", "@size": "1438", "@ref": "si84", "@mimetype": "image/gif"}, {"@category": "thumbnail", "@height": "56", "@width": "235", "@_fa": "true", "$": "https://api.elsevier.com/content/object/eid/1-s2.0-S0377221716304349-si85.gif?httpAccept=%2A%2F%2A", "@multimediatype": "GIF image file", "@type": "ALTIMG", "@size": "1027", "@ref": "si85", "@mimetype": "image/gif"}, {"@category": "thumbnail", "@height": "66", "@width": "376", "@_fa": "true", "$": "https://api.elsevier.com/content/object/eid/1-s2.0-S0377221716304349-si86.gif?httpAccept=%2A%2F%2A", "@multimediatype": "GIF image file", "@type": "ALTIMG", "@size": "1858", "@ref": "si86", "@mimetype": "image/gif"}, {"@category": "thumbnail", "@height": "24", "@width": "430", "@_fa": "true", "$": "https://api.elsevier.com/content/object/eid/1-s2.0-S0377221716304349-si87.gif?httpAccept=%2A%2F%2A", "@multimediatype": "GIF image file", "@type": "ALTIMG", "@size": "1348", "@ref": "si87", "@mimetype": "image/gif"}, {"@category": "thumbnail", "@height": "24", "@width": "449", "@_fa": "true", "$": "https://api.elsevier.com/content/object/eid/1-s2.0-S0377221716304349-si88.gif?httpAccept=%2A%2F%2A", "@multimediatype": "GIF image file", "@type": "ALTIMG", "@size": "1588", "@ref": "si88", "@mimetype": "image/gif"}, {"@category": "thumbnail", "@height": "16", "@width": "57", "@_fa": "true", "$": "https://api.elsevier.com/content/object/eid/1-s2.0-S0377221716304349-si89.gif?httpAccept=%2A%2F%2A", "@multimediatype": "GIF image file", "@type": "ALTIMG", "@size": "287", "@ref": "si89", "@mimetype": "image/gif"}, {"@category": "thumbnail", "@height": "24", "@width": "73", "@_fa": "true", "$": "https://api.elsevier.com/content/object/eid/1-s2.0-S0377221716304349-si9.gif?httpAccept=%2A%2F%2A", "@multimediatype": "GIF image file", "@type": "ALTIMG", "@size": "409", "@ref": "si9", "@mimetype": "image/gif"}, {"@category": "thumbnail", "@height": "25", "@width": "26", "@_fa": "true", "$": "https://api.elsevier.com/content/object/eid/1-s2.0-S0377221716304349-si91.gif?httpAccept=%2A%2F%2A", "@multimediatype": "GIF image file", "@type": "ALTIMG", "@size": "263", "@ref": "si91", "@mimetype": "image/gif"}, {"@category": "thumbnail", "@height": "22", "@width": "25", "@_fa": "true", "$": "https://api.elsevier.com/content/object/eid/1-s2.0-S0377221716304349-si92.gif?httpAccept=%2A%2F%2A", "@multimediatype": "GIF image file", "@type": "ALTIMG", "@size": "238", "@ref": "si92", "@mimetype": "image/gif"}, {"@category": "thumbnail", "@height": "79", "@width": "380", "@_fa": "true", "$": "https://api.elsevier.com/content/object/eid/1-s2.0-S0377221716304349-si93.gif?httpAccept=%2A%2F%2A", "@multimediatype": "GIF image file", "@type": "ALTIMG", "@size": "2368", "@ref": "si93", "@mimetype": "image/gif"}, {"@category": "thumbnail", "@height": "27", "@width": "78", "@_fa": "true", "$": "https://api.elsevier.com/content/object/eid/1-s2.0-S0377221716304349-si94.gif?httpAccept=%2A%2F%2A", "@multimediatype": "GIF image file", "@type": "ALTIMG", "@size": "488", "@ref": "si94", "@mimetype": "image/gif"}, {"@category": "thumbnail", "@height": "66", "@width": "254", "@_fa": "true", "$": "https://api.elsevier.com/content/object/eid/1-s2.0-S0377221716304349-si95.gif?httpAccept=%2A%2F%2A", "@multimediatype": "GIF image file", "@type": "ALTIMG", "@size": "1350", "@ref": "si95", "@mimetype": "image/gif"}, {"@category": "thumbnail", "@height": "66", "@width": "349", "@_fa": "true", "$": "https://api.elsevier.com/content/object/eid/1-s2.0-S0377221716304349-si96.gif?httpAccept=%2A%2F%2A", "@multimediatype": "GIF image file", "@type": "ALTIMG", "@size": "1876", "@ref": "si96", "@mimetype": "image/gif"}, {"@category": "thumbnail", "@height": "113", "@width": "354", "@_fa": "true", "$": "https://api.elsevier.com/content/object/eid/1-s2.0-S0377221716304349-si97.gif?httpAccept=%2A%2F%2A", "@multimediatype": "GIF image file", "@type": "ALTIMG", "@size": "2642", "@ref": "si97", "@mimetype": "image/gif"}, {"@category": "thumbnail", "@height": "51", "@width": "130", "@_fa": "true", "$": "https://api.elsevier.com/content/object/eid/1-s2.0-S0377221716304349-si98.gif?httpAccept=%2A%2F%2A", "@multimediatype": "GIF image file", "@type": "ALTIMG", "@size": "864", "@ref": "si98", "@mimetype": "image/gif"}, {"@category": "thumbnail", "@height": "110", "@width": "293", "@_fa": "true", "$": "https://api.elsevier.com/content/object/eid/1-s2.0-S0377221716304349-si99.gif?httpAccept=%2A%2F%2A", "@multimediatype": "GIF image file", "@type": "ALTIMG", "@size": "2256", "@ref": "si99", "@mimetype": "image/gif"}, {"@category": "thumbnail", "@height": "16", "@width": "56", "@_fa": "true", "$": "https://api.elsevier.com/content/object/eid/1-s2.0-S0377221716304349-si101.gif?httpAccept=%2A%2F%2A", "@multimediatype": "GIF image file", "@type": "ALTIMG", "@size": "238", "@ref": "si101", "@mimetype": "image/gif"}, {"@category": "thumbnail", "@height": "13", "@width": "52", "@_fa": "true", "$": "https://api.elsevier.com/content/object/eid/1-s2.0-S0377221716304349-si102.gif?httpAccept=%2A%2F%2A", "@multimediatype": "GIF image file", "@type": "ALTIMG", "@size": "226", "@ref": "si102", "@mimetype": "image/gif"}, {"@category": "thumbnail", "@height": "13", "@width": "51", "@_fa": "true", "$": "https://api.elsevier.com/content/object/eid/1-s2.0-S0377221716304349-si103.gif?httpAccept=%2A%2F%2A", "@multimediatype": "GIF image file", "@type": "ALTIMG", "@size": "220", "@ref": "si103", "@mimetype": "image/gif"}, {"@category": "thumbnail", "@height": "16", "@width": "47", "@_fa": "true", "$": "https://api.elsevier.com/content/object/eid/1-s2.0-S0377221716304349-si104.gif?httpAccept=%2A%2F%2A", "@multimediatype": "GIF image file", "@type": "ALTIMG", "@size": "202", "@ref": "si104", "@mimetype": "image/gif"}, {"@category": "thumbnail", "@height": "29", "@width": "234", "@_fa": "true", "$": "https://api.elsevier.com/content/object/eid/1-s2.0-S0377221716304349-si105.gif?httpAccept=%2A%2F%2A", "@multimediatype": "GIF image file", "@type": "ALTIMG", "@size": "1032", "@ref": "si105", "@mimetype": "image/gif"}, {"@category": "thumbnail", "@height": "27", "@width": "117", "@_fa": "true", "$": "https://api.elsevier.com/content/object/eid/1-s2.0-S0377221716304349-si106.gif?httpAccept=%2A%2F%2A", "@multimediatype": "GIF image file", "@type": "ALTIMG", "@size": "568", "@ref": "si106", "@mimetype": "image/gif"}, {"@category": "thumbnail", "@height": "23", "@width": "169", "@_fa": "true", "$": "https://api.elsevier.com/content/object/eid/1-s2.0-S0377221716304349-si107.gif?httpAccept=%2A%2F%2A", "@multimediatype": "GIF image file", "@type": "ALTIMG", "@size": "791", "@ref": "si107", "@mimetype": "image/gif"}, {"@category": "thumbnail", "@height": "23", "@width": "183", "@_fa": "true", "$": "https://api.elsevier.com/content/object/eid/1-s2.0-S0377221716304349-si108.gif?httpAccept=%2A%2F%2A", "@multimediatype": "GIF image file", "@type": "ALTIMG", "@size": "859", "@ref": "si108", "@mimetype": "image/gif"}, {"@category": "thumbnail", "@height": "13", "@width": "56", "@_fa": "true", "$": "https://api.elsevier.com/content/object/eid/1-s2.0-S0377221716304349-si109.gif?httpAccept=%2A%2F%2A", "@multimediatype": "GIF image file", "@type": "ALTIMG", "@size": "255", "@ref": "si109", "@mimetype": "image/gif"}, {"@category": "thumbnail", "@height": "26", "@width": "172", "@_fa": "true", "$": "https://api.elsevier.com/content/object/eid/1-s2.0-S0377221716304349-si11.gif?httpAccept=%2A%2F%2A", "@multimediatype": "GIF image file", "@type": "ALTIMG", "@size": "820", "@ref": "si11", "@mimetype": "image/gif"}, {"@category": "thumbnail", "@height": "31", "@width": "378", "@_fa": "true", "$": "https://api.elsevier.com/content/object/eid/1-s2.0-S0377221716304349-si111.gif?httpAccept=%2A%2F%2A", "@multimediatype": "GIF image file", "@type": "ALTIMG", "@size": "1504", "@ref": "si111", "@mimetype": "image/gif"}, {"@category": "thumbnail", "@height": "13", "@width": "46", "@_fa": "true", "$": "https://api.elsevier.com/content/object/eid/1-s2.0-S0377221716304349-si112.gif?httpAccept=%2A%2F%2A", "@multimediatype": "GIF image file", "@type": "ALTIMG", "@size": "227", "@ref": "si112", "@mimetype": "image/gif"}, {"@category": "thumbnail", "@height": "18", "@width": "17", "@_fa": "true", "$": "https://api.elsevier.com/content/object/eid/1-s2.0-S0377221716304349-si113.gif?httpAccept=%2A%2F%2A", "@multimediatype": "GIF image file", "@type": "ALTIMG", "@size": "124", "@ref": "si113", "@mimetype": "image/gif"}, {"@category": "thumbnail", "@height": "14", "@width": "46", "@_fa": "true", "$": "https://api.elsevier.com/content/object/eid/1-s2.0-S0377221716304349-si114.gif?httpAccept=%2A%2F%2A", "@multimediatype": "GIF image file", "@type": "ALTIMG", "@size": "227", "@ref": "si114", "@mimetype": "image/gif"}, {"@category": "thumbnail", "@height": "16", "@width": "51", "@_fa": "true", "$": "https://api.elsevier.com/content/object/eid/1-s2.0-S0377221716304349-si115.gif?httpAccept=%2A%2F%2A", "@multimediatype": "GIF image file", "@type": "ALTIMG", "@size": "225", "@ref": "si115", "@mimetype": "image/gif"}, {"@category": "thumbnail", "@height": "16", "@width": "60", "@_fa": "true", "$": "https://api.elsevier.com/content/object/eid/1-s2.0-S0377221716304349-si116.gif?httpAccept=%2A%2F%2A", "@multimediatype": "GIF image file", "@type": "ALTIMG", "@size": "256", "@ref": "si116", "@mimetype": "image/gif"}, {"@category": "thumbnail", "@height": "13", "@width": "44", "@_fa": "true", "$": "https://api.elsevier.com/content/object/eid/1-s2.0-S0377221716304349-si12.gif?httpAccept=%2A%2F%2A", "@multimediatype": "GIF image file", "@type": "ALTIMG", "@size": "216", "@ref": "si12", "@mimetype": "image/gif"}, {"@category": "thumbnail", "@height": "9", "@width": "11", "@_fa": "true", "$": "https://api.elsevier.com/content/object/eid/1-s2.0-S0377221716304349-si1.gif?httpAccept=%2A%2F%2A", "@multimediatype": "GIF image file", "@type": "ALTIMG", "@size": "64", "@ref": "si1", "@mimetype": "image/gif"}]}, "link": {"@rel": "abstract", "@href": "https://api.elsevier.com/content/abstract/scopus_id/84990232272"}}